,6390,,,56127,05657,King Street,King Street,"King Street, East of John Street",King Street,East of John Street,King,Street,John Street,20,0000527,0200,B,89,B89,Arterial Road,OnGround,TwoOrMoreLanes,Street,State,Hunter,Lake Macquarie,Warners Bay,2282,Trafficorder Tube Axlepair Counter,false,0,0,9733832,4520795,-32.975227,151.64682,9,5,true,cefde3b3d8db0587897ea9452f89d2be,2018-06-12 02:48:41.978017+00
,6391,,,56829,28032,Arthur Street,Arthur Street,"Arthur Street, West of Richmond Road",Arthur Street,West of Richmond Road,Arthur,Street,Richmond Road,100,0002057,0090,NULL,NULL,NULL,Arterial Road,OnGround,TwoOrMoreLanes,Street,Regional,Sydney,Strathfield,Strathfield,2135,Trafficorder Tube Axlepair Counter,false,0,0,9675485,4424307.5,-33.867176,151.062698,10,5,true,7036b343d0fad619220aba4c554748e9,2018-06-12 02:48:41.978017+00
,6392,,,58509,96550,Gwydir Highway,Gwydir Highway,"Gwydir Highway, East of Merrywinebone Road",Gwydir Highway,East of Merrywinebone Road,Gwydir,Highway,Merrywinebone Road,1900,0000012,0790,B,76,B76,Primary Road,OnGround,TwoOrMoreLanes,Highway,State,Western,Walgett,Collarenebri,2833,Trafficorder Dual Tube Classifier,false,0,0,9462334,4909059,-29.54801,148.673126,10,5,true,3a3620b12606ed477edcbd9d6dfbace6,2018-06-12 02:48:41.978017+00
,6393,,,56827,28028,Hume Highway,Hume Highway,"Hume Highway, North of Waterloo Road","Hume.liverpool Rd, Greenacre",North of Waterloo Road,Hume,Highway,Waterloo Road,70,0000002,0222,A,22,A22,Primary Road,OnGround,TwoOrMoreLanes,Highway,State,Sydney,Bankstown,Greenacre,2190,Trafficorder Loop Counter,false,1,0,9675197,4421893.5,-33.889046,151.060608,10,4,true,2927a307bc09968f53aff8ed61c549c8,2018-06-12 02:48:41.978017+00
,6394,,,55408,02394,South Dowling Street,South Dowling Street,"South Dowling Street, South of Rose Terrace",South Dowling Street,South of Rose Terrace,South Dowling,Street,Rose Terrace,40,0000593,2000,NULL,NULL,NULL,Arterial Road,OnGround,TwoOrMoreLanes,Street,State,Sydney,Sydney,Darlinghurst,2010,Trafficorder Tube Axlepair Counter,false,0,0,9689829,4422011,-33.882751,151.218735,9,5,true,c305b050995bec1e2e1f10095673cfb3,2018-06-12 02:48:41.978017+00
,6395,,,58718,99186,Great Western Highway,Great Western Highway,"Great Western Highway, East of Gemalong Close",Great Western Highway,East of Gemalong Close,Great Western,Highway,Gemalong Close,70,0000005,1631,A,32,A32,Primary Road,OnGround,TwoOrMoreLanes,Highway,State,Western,Lithgow,Marrangaroo,2790,Trafficorder Dual Tube Classifier,false,0,0,9587474,4476132,-33.426975,150.094482,10,5,true,22a4a594c9e52e226cb98bf4942ce861,2018-06-12 02:48:41.978017+00
,6396,,,57654,91591,Warialda Road,Warialda Road,"Warialda Road, North of J A Mcgregor Drive",Tamworth-Yetman Road,North of J A Mcgregor Drive,Warialda,Road,J A Mcgregor Drive,630,0000063,0360,NULL,NULL,NULL,Arterial Road,OnGround,TwoOrMoreLanes,Road,Regional,Northern,Gwydir,Warialda,2402,Trafficorder Tube Axlepair Counter,false,0,1,9647209,4906956,-29.525082,150.578217,9,5,true,060c2f8a551960940187cc31f91da305,2018-06-12 02:48:41.978017+00
,6397,,,55710,05001,Pacific Highway,Pacific Highway,"Pacific Highway, West of Tomago Road","Pacific.pacific Highway, Hexham",West of Tomago Road,Pacific,Highway,Tomago Road,380,0000010,1710,A,1,A1,Primary Road,OnGround,TwoOrMoreLanes,Highway,State,Hunter,Port Stephens,Tomago,2322,Trafficorder Loop Counter,false,1,0,9738908,4537987.5,-32.818165,151.692841,9,4,true,109f58b923dcedc3c0ce4b367f99a65e,2018-06-12 02:48:41.978017+00
,6398,,,56729,21029,Military Road,Military Road,"Military Road, West of Watson Street","Military.military Rd, Cremorne",West of Watson Street,Military,Road,Watson Street,40,0000164,0170,A,8,A8,Arterial Road,OnGround,TwoOrMoreLanes,Road,State,Sydney,North Sydney,Neutral Bay,2089,Trafficorder Loop Counter,false,1,0,9690003,4427860,-33.829956,151.218063,10,4,true,a56348ef518b1feb6a83ad32d884fafd,2018-06-12 02:48:41.978017+00
,6399,,,56519,09122,Pacific Highway,Pacific Highway,"Pacific Highway, North of Possum Way",Pacific Highway,North of Possum Way,Pacific,Highway,Possum Way,500,0000010,2160,A,1,A1,Primary Road,OnGround,TwoOrMoreLanes,Highway,State,Northern,Port Macquarie-Hastings,Kew,2439,Trafficorder Tube Axlepair Counter,false,0,1,9842764,4665547,-31.621662,152.726563,9,5,true,9ff45dbeb9a7d98678443aa5901b4467,2018-06-12 02:48:41.978017+00
,6400,,,57075,51008,Epping Road,Epping Road,"Epping Road, South of Herring Road",Epping Road,South of Herring Road,Epping,Road,Herring Road,70,0000373,0090,NULL,NULL,NULL,Local Road,OnGround,OneLane,Road,State,Sydney,Ryde,Macquarie Park,2113,Trafficorder Tube Axlepair Counter,false,0,0,9680613,4433539.5,-33.782124,151.114197,10,5,true,30e49ecaf63b76e78ada53bbb0625f1f,2018-06-12 02:48:41.978017+00
,6401,,,55807,05122,George Downes Drive,George Downes Drive,"George Downes Drive, North of The Link Road",George Downes Drive,North of The Link Road,George Downes,Drive,The Link Road,140,0000590,0010,NULL,NULL,NULL,Arterial Road,OnGround,TwoOrMoreLanes,Drive,Regional,Hunter,Gosford,Central Mangrove,2250,Trafficorder Tube Axlepair Counter,false,0,1,9694002,4485677.5,-33.307156,151.235931,9,5,true,b4f53e67dde0c2960bf0d874c437c6e0,2018-06-12 02:48:41.978017+00
,6402,,,56245,07094,Illawarra Highway,Illawarra Highway,"Illawarra Highway, South of Clover Hill Road","Illawarra.illawarra Highway, Macquarie Pass",South of Clover Hill Road,Illawarra,Highway,Clover Hill Road,90,0000025,0032,A,48,A48,Primary Road,OnGround,TwoOrMoreLanes,Highway,State,Southern,Shellharbour,Macquarie Pass,2577,Trafficorder Loop Counter,false,1,0,9635829,4348208,-34.566525,150.662857,10,4,true,79aae1982b12c7b67ee0481a613e57c8,2018-06-12 02:48:41.978017+00
,6403,,,57571,91029,New England Highway,New England Highway,"New England Highway, South of Rouse Street",New England Highway,South of Rouse Street,New England,Highway,Rouse Street,0,0000009,1480,A,15,A15,Primary Road,OnBridge,TwoOrMoreLanes,Highway,State,Northern,Tenterfield,Tenterfield,2372,Trafficorder Tube Axlepair Counter,false,0,1,9788912,4951915,-29.067877,152.014404,9,5,true,ded3bb043b98d3281f12d5ab914d8280,2018-06-12 02:48:41.978017+00
,6404,,,57683,92086,Newell Highway,Newell Highway,"Newell Highway, South of Warkton Road",Newell Highway,South of Warkton Road,Newell,Highway,Warkton Road,1910,0000017,3041,A,39,A39,Primary Road,OnGround,TwoOrMoreLanes,Highway,State,Western,Warrumbungle,Wattle Springs,2357,Trafficorder Dual Tube Classifier,false,0,1,9513414,4702115.5,-31.405266,149.245285,10,5,true,cf3e4e2eaa55cf1177b3dc2d6995c35e,2018-06-12 02:48:41.978017+00
,6405,,,55756,05051,Pacific Highway,Pacific Highway,"Pacific Highway, North of Mildon Road",Pacific Highway,North of Mildon Road,Pacific,Highway,Mildon Road,150,0000010,1120,NULL,NULL,NULL,Primary Road,OnGround,TwoOrMoreLanes,Highway,State,Hunter,Wyong,Tuggerah,2259,Trafficorder Tube Axlepair Counter,false,0,0,9711235,4485534.5,-33.302006,151.421051,9,5,true,753e63f4660d935b6347f727bd330332,2018-06-12 02:48:41.978017+00
,6406,,,57688,92112,Gundy Road,Gundy Road,"Gundy Road, East of Kilgallin Close",Gundy Road,East of Kilgallin Close,Gundy,Road,Kilgallin Close,100,0000105,0020,NULL,NULL,NULL,Arterial Road,OnGround,TwoOrMoreLanes,Road,Regional,Hunter,Upper Hunter,Scone,2337,Trafficorder Tube Axlepair Counter,false,0,1,9666139,4625259,-32.058128,150.880936,10,5,true,784dd63a3dee4ba5ff6566172837b972,2018-06-12 02:48:41.978017+00
,6407,,,57128,53209,Pacific Highway,Pacific Highway,"Pacific Highway, West of Lucinda Avenue","Pacific.pacific Hwy, Wahroonga",West of Lucinda Avenue,Pacific,Highway,Lucinda Avenue,30,0000010,0640,A,1,A1,Primary Road,OnGround,TwoOrMoreLanes,Highway,State,Sydney,Ku-Ring-Gai,Wahroonga,2076,Trafficorder Loop Counter,false,1,0,9680564,4440572,-33.718727,151.110672,10,4,true,e348a55cd1da1e35495f19d9bd1cebc6,2018-06-12 02:48:41.978017+00
,6408,,,56517,09115,Pacific Highway,Pacific Highway,"Pacific Highway, East of Ghinni Ghinni School Road",Pacific Highway,East of Ghinni Ghinni School Road,Pacific,Highway,Ghinni Ghinni School Road,220,0000010,2030,A,1,A1,Primary Road,OnGround,TwoOrMoreLanes,Highway,State,Hunter,Greater Taree,Ghinni Ghinni,2430,Trafficorder Tube Axlepair Counter,false,0,1,9825257,4637954,-31.878824,152.557663,9,5,true,11e585f727cf6a13714fe31d48012a53,2018-06-12 02:48:41.978017+00
,6409,,,55923,05283,Maitland Road,Maitland Road,"Maitland Road, North of Kerr Street",Maitland Road,North of Kerr Street,Maitland,Road,Kerr Street,30,0000464,0150,NULL,NULL,NULL,Primary Road,OnGround,TwoOrMoreLanes,Road,Regional,Hunter,Newcastle,Mayfield,2304,Trafficorder Tube Axlepair Counter,false,0,0,9742554,4529083.5,-32.896961,151.736084,9,5,true,25bb5d75b99839f2f1c20c5d5a022562,2018-06-12 02:48:41.978017+00
,6410,,,58221,95138,Olympic Highway,Olympic Highway,"Olympic Highway, South of Crudens Lane",Olympic Highway,South of Crudens Lane,Olympic,Highway,Crudens Lane,120,0000078,0270,A,41,A41,Arterial Road,OnGround,TwoOrMoreLanes,Highway,State,South West,Junee,Yathella,2650,Trafficorder Dual Tube Classifier,false,0,1,9345561,4319856.5,-34.874378,147.498596,9,5,true,96567006ba7e437cb2bb63f5a7c1d7f2,2018-06-12 02:48:41.978017+00
,6411,,,57025,50001,Silverwater Road,Silverwater Road,"Silverwater Road, West of Allambie Street","Silverwater.silverwater Rd, Lidcombe",West of Allambie Street,Silverwater,Road,Allambie Street,110,0000190,1342,A,6,A6,Arterial Road,OnBridge,TwoOrMoreLanes,Road,State,Sydney,Parramatta,Rydalmere,2116,Trafficorder Loop Counter,false,1,0,9674621,4429138.5,-33.823917,151.051331,9,4,true,2f95ac979df3cbb029c2bda2e2da1e29,2018-06-12 02:48:41.978017+00
,6412,,,56251,07102,Corrimal Street,Corrimal Street,"Corrimal Street, North of Crown Street",Corrimal Street,North of Crown Street,Corrimal,Street,Crown Street,80,0000581,0101,B,65,B65,Arterial Road,OnGround,TwoOrMoreLanes,Street,State,Southern,Wollongong,Wollongong,2500,Trafficorder Loop Counter,false,1,0,9658143,4363085,-34.425117,150.899948,9,5,true,53cfe94832cc33df4d55512a97ee0eb5,2018-06-12 02:48:41.978017+00
,6413,,,57892,93300,Parkes Road,Parkes Road,"Parkes Road, North of Dowling Street",Dowling Street,North of Dowling Street,Parkes,Road,Dowling Street,10,0000017,2605,A,39,A39,Primary Road,OnGround,TwoOrMoreLanes,Street,State,Western,Forbes,Forbes,2871,Trafficorder Dual Tube Classifier,false,0,0,9394107,4485166.5,-33.379753,148.012329,9,5,true,34b25b15d54e7d06e3f41f1dbc2f1230,2018-06-12 02:48:41.978017+00
,6414,,,56587,09909,Pacific Highway,Pacific Highway,"Pacific Highway, North of Myall River Road",Pacific Highway,North of Myall River Road,Pacific,Highway,Myall River Road,1980,0000010,1880,A,1,A1,Primary Road,OnGround,TwoOrMoreLanes,Highway,Local,Hunter,Great Lakes,Bulahdelah,2423,Trafficorder Tube Axlepair Counter,false,0,1,9788064,4576400.5,-32.450874,152.197174,9,5,true,ba9eefe6481ee36274ac1935d827fcf7,2018-06-12 02:48:41.978017+00
,6415,,,58372,95640,Banna Avenue,Banna Avenue,"Banna Avenue, East of Wayeela Street",Banna Avenue,East of Wayeela Street,Banna,Avenue,Wayeela Street,40,0000080,0200,B,87,B87,Arterial Road,OnGround,TwoOrMoreLanes,Avenue,State,South West,Griffith,Griffith,2680,Trafficorder Tube Axlepair Counter,false,0,0,9211703,4384651.5,-34.287212,146.040237,10,5,true,28096334e2162cd7d70410737bec52fc,2018-06-12 02:48:41.978017+00
,6416,,,56257,07124,Princes Highway,Princes Highway,"Princes Highway, North of Woodhill Street",Old Princes Highway,North of Woodhill Street,Princes,Highway,Woodhill Street,20,0000095,0007,NULL,NULL,NULL,Primary Road,OnGround,TwoOrMoreLanes,Highway,State,Southern,Wollongong,Fairy Meadow,2519,Trafficorder Tube Axlepair Counter,false,0,0,9657421,4365510,-34.403503,150.891129,9,5,true,b21df970a633512b08a7b7cab8e8f204,2018-06-12 02:48:41.978017+00
,6417,,,58283,95370,Spring Drive,Spring Drive,"Spring Drive, South of Lees Road",Spring Drive,South of Lees Road,Spring,Drive,Lees Road,2500,0000314,0040,NULL,NULL,NULL,Arterial Road,OnGround,TwoOrMoreLanes,Drive,State,South West,Corowa,Mulwala,2647,Trafficorder Tube Axlepair Counter,false,0,1,9218996,4195269,-35.995384,146.101807,10,5,true,cd01843e96dc1e7922ac9f7c986410fe,2018-06-12 02:48:41.978017+00
,6418,,,15934014,T0482,Pacific Highway,Pacific Highway,"Pacific Highway, West of Twelve Mile Creek Road","Pacific.pacific Highway, Raymond Terrace",West of Twelve Mile Creek Road,Pacific,Highway,Twelve Mile Creek Road,450,0000010,1810,A,1,A1,Primary Road,OnGround,TwoOrMoreLanes,Highway,State,Hunter,Port Stephens,Twelve Mile Creek,2324,Tirtl,false,1,1,9754726,4555316,-32.655415,151.853134,5,5,true,7dc406ed95bec222dac8cd7c46acd85f,2018-06-12 02:48:41.978017+00
,6419,,,56302,07365,Moss Vale Road,Moss Vale Road,"Moss Vale Road, North of Carrington Street","Moss Vale.moss Vale Rd, Burradoo",North of Carrington Street,Moss Vale,Road,Carrington Street,20,0000260,0030,NULL,NULL,NULL,Arterial Road,OnGround,TwoOrMoreLanes,Road,State,Southern,Wingecarribee,Bowral,2576,Trafficorder Loop Counter,false,1,0,9613398,4357910.5,-34.485901,150.414932,9,4,true,2a0fb722d1a834e7feedeb1c49cb6aa1,2018-06-12 02:48:41.978017+00
,6420,,,55685,04660,Byron Bay Road,Byron Bay Road,"Byron Bay Road, North of Byron Street",Byron Bay Road,North of Byron Street,Byron Bay,Road,Byron Street,370,0000545,0071,NULL,NULL,NULL,Sub-Arterial Road,OnGround,TwoOrMoreLanes,Road,Regional,Northern,Ballina,Lennox Head,2478,Trafficorder Tube Axlepair Counter,false,0,1,9943615,4974515,-28.787359,153.582794,9,5,true,34ea13675035bcf6f105125f5a555795,2018-06-12 02:48:41.978017+00
,6421,,,58293,95393,Goldfields Way,Goldfields Way,"Goldfields Way, North of Mcdougalls Road",Goldfields Way,North of Mcdougalls Road,Goldfields,Way,Mcdougalls Road,2220,0000057,0050,B,85,B85,Arterial Road,OnGround,TwoOrMoreLanes,Way,State,South West,Temora,Temora,2666,Trafficorder Tube Axlepair Counter,false,0,1,9346584,4361554.5,-34.498222,147.507584,9,5,true,5e943c0f5d0425b7095c6060a8b3ce39,2018-06-12 02:48:41.978017+00
,6422,,,58701,99041,Great Western Highway,Great Western Highway,"Great Western Highway, West of Kitchener Road",Great Western Highway,West of Kitchener Road,Great Western,Highway,Kitchener Road,110,0000005,1404,A,32,A32,Primary Road,OnGround,TwoOrMoreLanes,Highway,State,Sydney,Blue Mountains,Leura,2780,Trafficorder Tube Axlepair Counter,false,0,0,9609910,4444267.5,-33.708157,150.346817,10,5,true,27c999ad98cc350c8fb9df9c64666983,2018-06-12 02:48:41.978017+00
,6423,,,56918,37022,Heathcote Road,Heathcote Road,"Heathcote Road, West of Beethoven Street","Heathcote.heathcote Rd, Heathcote",West of Beethoven Street,Heathcote,Road,Beethoven Street,210,0000512,0020,A,6,A6,Arterial Road,OnGround,TwoOrMoreLanes,Road,State,Sydney,Sutherland,Engadine,2233,Excel Lpl,false,1,1,9668900,4401774,-34.072643,151.000855,9,4,true,e68cdfe531a2d7c0e8db58d992e15c7f,2018-06-12 02:48:41.978017+00
,6424,,,57438,74224,Pennant Hills Road,Pennant Hills Road,"Pennant Hills Road, East of Woodstock Road",Pennant Hills Road,East of Woodstock Road,Pennant Hills,Road,Woodstock Road,50,0000013,1400,A,28,A28,Primary Road,OnGround,TwoOrMoreLanes,Road,State,Sydney,The Hills,Carlingford,2118,Trafficorder Loop Counter,false,1,0,9674706,4435189.5,-33.769329,151.049728,9,5,true,c33cc5f7d33e6070bf4a9d0221951b0f,2018-06-12 02:48:41.978017+00
,6425,,,57159,57024,Mona Vale Road,Mona Vale Road,"Mona Vale Road, East of Addison Road","Mona Vale.mona Vale Rd, Terrey Hills",East of Addison Road,Mona Vale,Road,Addison Road,90,0000162,0255,A,3,A3,Arterial Road,OnGround,TwoOrMoreLanes,Road,State,Sydney,Warringah,Ingleside,2101,Tirtl,false,1,1,9694242,4443588,-33.686592,151.256943,10,5,true,501cc376e790bdf9947ac7392da2e000,2018-06-12 02:48:41.978017+00
,6426,,,58161,94500,Gundaroo Road,Gundaroo Road,"Gundaroo Road, South of Hume Highway",Gundaroo Road,South of Hume Highway,Gundaroo,Road,Hume Highway,490,0000052,0265,NULL,NULL,NULL,Arterial Road,OnGround,TwoOrMoreLanes,Road,Regional,Southern,Upper Lachlan,Gunning,2581,Trafficorder Tube Axlepair Counter,false,0,1,9506124,4327013,-34.79076,149.253738,9,5,true,0969e31bdbcddd89f90fc61b0c66c1ef,2018-06-12 02:48:41.978017+00
,6427,,,57948,93653,Adelaide Street,Adelaide Street,"Adelaide Street, South of Church Street",Adelaide Street,South of Church Street,Adelaide,Street,Church Street,50,0000006,0100,A,41,A41,Arterial Road,OnGround,TwoOrMoreLanes,Street,State,Western,Blayney,Blayney,2799,Trafficorder Tube Axlepair Counter,false,0,0,9509301,4466595,-33.531078,149.255508,9,5,true,cd0617b2a173fad574cd393e2191e79a,2018-06-12 02:48:41.978017+00
,6428,,,56596,09925,The Lakes Way,The Lakes Way,"The Lakes Way, North of Green Point Drive",The Lakes Way,North of Green Point Drive,The Lakes Way,,Green Point Drive,150,0000111,0065,NULL,NULL,NULL,Arterial Road,OnGround,TwoOrMoreLanes,,Regional,Hunter,Great Lakes,Forster,2428,Trafficorder Tube Axlepair Counter,false,0,1,9821040,4596710,-32.252533,152.53624,9,5,true,75098bf06b8dbf8452814b00a06afc14,2018-06-12 02:48:41.978017+00
,6429,,,57062,50388,Darcy Road,Darcy Road,"Darcy Road, West of Lindsay Street",Darcy Road,West of Lindsay Street,Darcy,Road,Lindsay Street,30,0007481,0010,NULL,NULL,NULL,Distributor Road,OnGround,TwoOrMoreLanes,Road,Regional,Sydney,Parramatta,Wentworthville,2145,Trafficorder Tube Axlepair Counter,false,0,0,9667336,4431744,-33.802948,150.971558,10,5,true,b34baba63c5d0b67d4ca01a29fd389f8,2018-06-12 02:48:41.978017+00
,6430,,,58637,97488,Sturt Highway,Sturt Highway,"Sturt Highway, South of Duryea Street",Sturt Highway,South of Duryea Street,Sturt,Highway,Duryea Street,870,0000694,0070,NULL,NULL,NULL,Primary Road,OnGround,TwoOrMoreLanes,Highway,Local,South West,Balranald,Balranald,2715,Trafficorder Tube Axlepair Counter,false,0,1,8985146,4337822,-34.666584,143.562012,9,5,true,4f03063b32ddd2c0d9ea5476c7b1ac81,2018-06-12 02:48:41.978017+00
,6431,,,55758,05052,Maitland Road,Maitland Road,"Maitland Road, West of Galleghan Street",Maitland Road,West of Galleghan Street,Maitland,Road,Galleghan Street,370,0000010,1705,A,43,A43,Primary Road,OnGround,TwoOrMoreLanes,Road,Local,Hunter,Newcastle,Hexham,2322,Trafficorder Tube Axlepair Counter,false,0,1,9738198,4536445.5,-32.832359,151.686005,9,5,true,326fa846447e2b2da5e7372f9d76ee7e,2018-06-12 02:48:41.978017+00
,6432,,,56549,09339,The Bucketts Way,The Bucketts Way,"The Bucketts Way, East of Hillview Lane",The Bucketts Way,East of Hillview Lane,The Bucketts Way,,Hillview Lane,270,-10,-10,NULL,NULL,NULL,Arterial Road,OnGround,TwoOrMoreLanes,,Local,Hunter,Greater Taree,Burrell Creek,2429,Trafficorder Tube Axlepair Counter,false,0,1,9801847,4631304.5,-31.949741,152.313995,10,5,true,931afeb97c242e5e1f6adf385b695aa0,2018-06-12 02:48:41.978017+00
,6433,,,328012,95001,Sturt Highway,Sturt Highway,"Sturt Highway, East of Tumbarumba Road",Sturt Highway,East of Tumbarumba Road,Sturt,Highway,Tumbarumba Road,50,0000014,0030,A,20,A20,Primary Road,OnGround,TwoOrMoreLanes,Highway,State,South West,Wagga Wagga,Alfredtown,2650,Trafficorder Tube Axlepair Counter,false,0,0,9346815,4288032.5,-35.161312,147.514038,10,5,true,b561705e4c8462439d57e374ca4de75a,2018-06-12 02:48:41.978017+00
,6434,,,57555,88046,Bridge Street,Bridge Street,"Bridge Street, North of Court Street","Bridge.bridge St, Mcgraths Hill",North of Court Street,Bridge,Street,Court Street,20,0000184,0310,A,2,A2,Arterial Road,OnGround,TwoOrMoreLanes,Street,State,Sydney,Hawkesbury,Windsor,2756,Trafficorder Loop Counter,false,1,0,9654549,4454086,-33.605782,150.824585,10,4,true,f8e6608d9c6ce1c3dc3349c30e8118c7,2018-06-12 02:48:41.978017+00
,6435,,,58589,97256,Berrigan Road,Berrigan Road,"Berrigan Road, South of Wunnamurra Road",Berrigan-Jerilderie Road,South of Wunnamurra Road,Berrigan,Road,Wunnamurra Road,830,0000564,0040,NULL,NULL,NULL,Arterial Road,OnGround,TwoOrMoreLanes,Road,Regional,South West,Jerilderie,Jerilderie,2716,Trafficorder Tube Axlepair Counter,false,0,1,9182643,4258362,-35.423321,145.707413,9,5,true,60902080fff04e624c272ba2dfe06dbb,2018-06-12 02:48:41.978017+00
,6436,,,57983,93806,Caswell Street,Caswell Street,"Caswell Street, South of Ingalba Street",Caswell Street,South of Ingalba Street,Caswell,Street,Ingalba Street,60,0000017,2750,A,39,A39,Primary Road,OnGround,TwoOrMoreLanes,Street,State,Western,Parkes,Peak Hill,2869,Trafficorder Tube Axlepair Counter,false,0,0,9411389,4558056,-32.72031,148.189285,9,5,true,1a01ee37577f30ae4a5d62a921a7fb6e,2018-06-12 02:48:41.978017+00
,6437,,,56272,07223,Princes Highway,Princes Highway,"Princes Highway, East of Second Avenue",Princes Highway,East of Second Avenue,Princes,Highway,Second Avenue,20,0000001,1200,NULL,NULL,NULL,Primary Road,OnGround,TwoOrMoreLanes,Highway,State,Southern,Wollongong,Unanderra,2526,Trafficorder Tube Axlepair Counter,false,0,0,9653358,4360486,-34.45015,150.848938,9,5,true,29294833008908f3fd2b963a11d279fe,2018-06-12 02:48:41.978017+00
,6438,,,56868,33013,Pacific Highway,Pacific Highway,"Pacific Highway, South of Boundary Street","Pacific.pacific Hwy, West Chatswood",South of Boundary Street,Pacific,Highway,Boundary Street,50,0000010,0360,A,1,A1,Primary Road,OnGround,TwoOrMoreLanes,Highway,State,Sydney,Willoughby,Roseville,2069,Trafficorder Dual Tube Classifier,false,1,0,9686608,4432661.5,-33.787891,151.179306,9,4,true,cb9c81bfbdce076de812951205423f9d,2018-06-12 02:48:41.978017+00
,6439,,,56838,29001,Homebush Bay Drive,Homebush Bay Drive,"Homebush Bay Drive, East of Oulton Avenue","Homebush Bay.homebush Bay Drive, Homebush",East of Oulton Avenue,Homebush Bay,Drive,Oulton Avenue,170,0000200,0385,A,3,A3,Arterial Road,OnBridge,TwoOrMoreLanes,Drive,State,Sydney,Canada Bay,Rhodes,2138,Trafficorder Loop Counter,false,1,0,9677765,4427623.5,-33.836475,151.085938,9,4,true,cd3d373c6a841277c7e7367babf11fb9,2018-06-12 02:48:41.978017+00
,6440,,,56749,23020,Princes Highway,Princes Highway,"Princes Highway, North of Rockdale Plaza Drive",Princes Highway,North of Rockdale Plaza Drive,Princes,Highway,Rockdale Plaza Drive,60,0000001,0330,A,36,A36,Primary Road,OnGround,TwoOrMoreLanes,Highway,State,Sydney,Rockdale,Rockdale,2216,Trafficorder Dual Tube Classifier,false,0,0,9682027,4414139,-33.956543,151.137756,1,5,true,977bb3ebefa6752da03c4fc9bb26f2cd,2018-06-12 02:48:41.978017+00
,6441,,,15828013,T0283,Hume Highway,Hume Highway Hvcs,"Hume Highway, East of George Street","Nb Offload To Weigh Station, Marulan.nb Offload To Weigh Station, Marulan",East of George Street,Hume,Highway,George Street,400,0000002,1132,M,31,M31,Primary Road,OnGround,TwoOrMoreLanes,Highway,State,Southern,Goulburn Mulwaree,Marulan,2579,Tirtl,true,1,1,9575813,4334638.5,-34.706158,150.012939,1,5,true,15ebd479cd7c7bbc93f0b3f3fa34a6c4,2018-06-12 02:48:41.978017+00
,6442,,,56077,05571,Main Road,Main Road,"Main Road, East of Fairleigh Street","Main.main Rd, Glendale",East of Fairleigh Street,Main,Road,Fairleigh Street,70,0000527,0280,B,89,B89,Arterial Road,OnGround,TwoOrMoreLanes,Road,State,Hunter,Lake Macquarie,Glendale,2285,Trafficorder Loop Counter,false,1,0,9733529,4525973.5,-32.928658,151.641113,10,5,true,abccd3e9578e25592d8bf3486aad0769,2018-06-12 02:48:41.978017+00
,6443,,,56763,23072,Stoney Creek Road,Stoney Creek Road,"Stoney Creek Road, East of Kinsel Grove",Stoney Creek Road,East of Kinsel Grove,Stoney Creek,Road,Kinsel Grove,60,0000665,0010,NULL,NULL,NULL,Arterial Road,OnGround,TwoOrMoreLanes,Road,State,Sydney,Rockdale,Bexley,2207,Trafficorder Tube Axlepair Counter,false,0,0,9680945,4414908.5,-33.949993,151.125732,10,5,true,16ff9adf6d11d091b4aff9e83a0bd555,2018-06-12 02:48:41.978017+00
,6444,,,58385,95679,Guinea Street,Guinea Street,"Guinea Street, West of Borella Road",Borella Road,West of Borella Road,Guinea,Street,Borella Road,20,0000020,1050,B,58,B58,Primary Road,OnGround,TwoOrMoreLanes,Road,State,South West,Albury,Albury,2640,Trafficorder Tube Axlepair Counter,false,0,0,9293347,4186745.5,-36.075298,146.926163,7,5,true,2787f4d69d6d51ba43935f2ec1aef943,2018-06-12 02:48:41.978017+00
,6445,,,58577,97218,Thule Street,Thule Street,"Thule Street, South of Murray Street",Thule Street,South of Murray Street,Thule,Street,Murray Street,40,0000319,0010,NULL,NULL,NULL,Arterial Road,OnBridge,TwoOrMoreLanes,Street,Regional,South West,Wakool,Barham,2732,Trafficorder Tube Axlepair Counter,false,0,0,9039631,4232553.5,-35.630219,144.125,1,5,true,0ea0c3af11f72c69451bac32aa2e7926,2018-06-12 02:48:41.978017+00
,6446,,,56346,07540,King Street,King Street,"King Street, North of Primbee Bypass",King Street,North of Primbee Bypass,King,Street,Primbee Bypass,110,0000522,0140,B,65,B65,Arterial Road,OnGround,TwoOrMoreLanes,Street,State,Southern,Wollongong,Warrawong,2502,Trafficorder Tube Axlepair Counter,false,0,0,9656837,4355138.5,-34.497196,150.888977,9,5,true,48f8c1c91c64267a4e9d2a460a47b595,2018-06-12 02:48:41.978017+00
,6447,,,57172,59106,Barrenjoey Road,Barrenjoey Road,"Barrenjoey Road, North of The Crescent",Barrenjoey Road,North of The Crescent,Barrenjoey,Road,The Crescent,30,0000164,0760,NULL,NULL,NULL,Arterial Road,OnGround,TwoOrMoreLanes,Road,State,Sydney,Pittwater,Avalon Beach,2107,Trafficorder Tube Axlepair Counter,false,0,0,9701241,4448720.5,-33.637718,151.330124,9,5,true,e0e3d8b264543eed600ff2a579ead0da,2018-06-12 02:48:41.978017+00
,6448,,,58599,97293,Jerilderie Street,Jerilderie Street,"Jerilderie Street, East of Bolton Street",Jerilderie Street,East of Bolton Street,Jerilderie,Street,Bolton Street,80,0000017,2110,A,39,A39,Primary Road,OnGround,TwoOrMoreLanes,Street,State,South West,Jerilderie,Jerilderie,2716,Trafficorder Tube Axlepair Counter,false,0,0,9184613,4265786,-35.356613,145.730102,10,5,true,42b2548249af0c27fbfc7a385ab98847,2018-06-12 02:48:41.978017+00
,6449,,,58369,95629,Lorne Street,Lorne Street,"Lorne Street, South of Meldrums Lane",Lorne Street,South of Meldrums Lane,Lorne,Street,Meldrums Lane,10,0000243,0120,NULL,NULL,NULL,Arterial Road,OnGround,TwoOrMoreLanes,Street,Regional,South West,Junee,Junee,2663,Trafficorder Tube Axlepair Counter,false,0,0,9353427,4320186.5,-34.871037,147.584671,9,5,true,f5a1cdd769d380c4ed23b0fc35f374e6,2018-06-12 02:48:41.978017+00
