,5973,,,56075,05570,Main Road,Main Road,"Main Road, West of Alfred Street",Main Road,West of Alfred Street,Main,Road,Alfred Street,90,0000527,0270,B,89,B89,Arterial Road,OnGround,TwoOrMoreLanes,Road,State,Hunter,Lake Macquarie,Glendale,2285,Trafficorder Tube Axlepair Counter,false,0,0,9734561,4525584,-32.931751,151.652329,10,5,true,36687f6b77ccdbb8489a2b07acb1773a,2018-06-12 02:48:41.978017+00
,5974,,,58877,HHW005,Hume Highway,Hume Highway,"Hume Highway, North of Paynes Road",Hume Highway,North of Paynes Road,Hume,Highway,Paynes Road,2110,0000002,1640,M,31,M31,Primary Road,OnGround,TwoOrMoreLanes,Highway,State,South West,Yass Valley,Bookham,2582,Tirtl,false,1,1,9455802,4328461.5,-34.786289,148.703384,9,4,true,fc83facb4061fdc4e2b2936f8f7baaa2,2018-06-12 02:48:41.978017+00
,5975,,,56791,24093,Wiley Avenue,Wiley Avenue,"Wiley Avenue, South of Roberts Road",Wiley Avenue,South of Roberts Road,Wiley,Avenue,Roberts Road,50,0000200,0185,A,3,A3,Arterial Road,OnGround,TwoOrMoreLanes,Avenue,State,Sydney,Bankstown,Greenacre,2190,Trafficorder Dual Tube Classifier,false,0,0,9675328,4418889,-33.916088,151.063293,9,5,true,5d0ac1169e3fffa3517a504a04b7012a,2018-06-12 02:48:41.978017+00
,5976,,,58358,95600,Edward Street,Edward Street,"Edward Street, West of Sanger Street",Edward Street,West of Sanger Street,Edward,Street,Sanger Street,60,1040250,0010,NULL,NULL,NULL,Local Road,OnGround,TwoOrMoreLanes,Street,Local,South West,Corowa,Corowa,2646,Trafficorder Tube Axlepair Counter,false,0,0,9245048,4194801.5,-36.001293,146.39064,10,5,true,ff15986fbeda635959ff7c06941f5674,2018-06-12 02:48:41.978017+00
,5977,,,56779,24015,Canterbury Road,Canterbury Road,"Canterbury Road, East of Denman Avenue",Canterbury Road,East of Denman Avenue,Canterbury,Road,Denman Avenue,40,0000167,0290,A,34,A34,Arterial Road,OnGround,TwoOrMoreLanes,Road,State,Sydney,Canterbury,Roselands,2196,Trafficorder Dual Tube Classifier,false,0,0,9676017,4417357.5,-33.929657,151.071381,10,5,true,5264fa3b3afecf85bea67c7bbe018e2a,2018-06-12 02:48:41.978017+00
,5978,,,15334030,T0342,Galston Road,Galston Road,"Galston Road, East of Calderwood Road","Galston.galston Rd, Hornsby Heights",East of Calderwood Road,Galston,Road,Calderwood Road,70,0000161,0020,NULL,NULL,NULL,Arterial Road,OnGround,TwoOrMoreLanes,Road,State,Sydney,Hornsby,Galston,2159,Tirtl,false,1,1,9676501,4447736.5,-33.65556,151.063828,10,5,true,03a921d901b877f877e799c3c841e545,2018-06-12 02:48:41.978017+00
,5979,,,55628,04422,Coramba Road,Coramba Road,"Coramba Road, South of Convincing Ground Road",Coramba Road,South of Convincing Ground Road,Coramba,Road,Convincing Ground Road,340,0000151,0040,NULL,NULL,NULL,Arterial Road,OnGround,TwoOrMoreLanes,Road,Regional,Northern,Coffs Harbour,Karangi,2450,Trafficorder Tube Axlepair Counter,false,0,1,9881660,4815967.5,-30.247154,153.044311,9,5,true,a41f125635c7acfa5ad4d2da3afa070c,2018-06-12 02:48:41.978017+00
,5980,,,58673,98223,Rakow Street,Rakow Street,"Rakow Street, West of Gypsum Street",Rakow Street,West of Gypsum Street,Rakow,Street,Gypsum Street,50,0000008,0490,A,32,A32,Primary Road,OnGround,TwoOrMoreLanes,Street,State,Western,Broken Hill,Broken Hill,2880,Trafficorder Tube Axlepair Counter,false,0,0,8774928,4628874,-31.960743,141.439178,10,5,true,7fe14351e1e7195011698b5d220c4751,2018-06-12 02:48:41.978017+00
,5981,,,56226,07038,Illawarra Highway,Illawarra Highway,"Illawarra Highway, West of Princes Highway",Jamberoo Road,West of Princes Highway,Illawarra,Highway,Princes Highway,130,0000025,0007,A,48,A48,Primary Road,OnGround,TwoOrMoreLanes,Road,State,Southern,Shellharbour,Albion Park Rail,2527,Trafficorder Tube Axlepair Counter,false,0,1,9647006,4349667,-34.549778,150.784073,10,5,true,5cfdc5da3f23076d7d20d5c8dbc98ebb,2018-06-12 02:48:41.978017+00
,5982,,,55865,05197,John Renshaw Drive,John Renshaw Drive,"John Renshaw Drive, East of Averys Lane",John Renshaw Drive,East of Averys Lane,John Renshaw,Drive,Averys Lane,410,0000588,0055,B,68,B68,Arterial Road,OnGround,TwoOrMoreLanes,Drive,Local,Hunter,Cessnock,Buchanan,2323,Trafficorder Tube Axlepair Counter,false,0,1,9722471,4537400,-32.830002,151.517593,10,5,true,87715059ac8c30c7d931ced1fcabf320,2018-06-12 02:48:41.978017+00
,5983,,,58511,96552,Hermidale Nymagee Road,Hermidale Nymagee Road,"Hermidale Nymagee Road, South of Currans Road",Hermidale Nymagee Road,South of Currans Road,Hermidale Nymagee,Road,Currans Road,1800,0000228,0050,NULL,NULL,NULL,Arterial Road,OnGround,TwoOrMoreLanes,Road,Regional,Western,Bogan,Hermidale,2831,Trafficorder Dual Tube Classifier,false,0,1,9272446,4685728,-31.573484,146.709595,9,5,true,cf1540a64fa3385a5e13937aa9ff2257,2018-06-12 02:48:41.978017+00
,5984,,,15828016,T0492,Remembrance Driveway,Remembrance Driveway,"Remembrance Driveway, West of Lupton Road","Remembrance.remembrance Drive, Yanderra",West of Lupton Road,Remembrance,Driveway,Lupton Road,680,0000620,0040,NULL,NULL,NULL,Arterial Road,OnGround,TwoOrMoreLanes,Drive,Regional,Southern,Wollondilly,Bargo,2574,Tirtl,false,1,1,9629749,4376498,-34.313366,150.586014,10,5,true,76b5d923a2fdf65c8c0bcc3d64a3ab3a,2018-06-12 02:48:41.978017+00
,5985,,,55811,05125,Terrigal Drive,Terrigal Drive,"Terrigal Drive, East of Serpentine Road",Terrigal Drive,East of Serpentine Road,Terrigal,Drive,Serpentine Road,40,0000505,0040,NULL,NULL,NULL,Distributor Road,OnGround,TwoOrMoreLanes,Drive,State,Hunter,Gosford,Terrigal,2260,Trafficorder Tube Axlepair Counter,false,0,0,9710209,4470452.5,-33.438389,151.416885,10,5,true,094754e08e5d46fbbd5503120262f33f,2018-06-12 02:48:41.978017+00
,5986,,,57668,92003,Newell Highway,Newell Highway,"Newell Highway, North of Warrumbungles Way",Newell Highway,North of Warrumbungles Way,Newell,Highway,Warrumbungles Way,1380,0000017,3060,A,39,A39,Primary Road,OnGround,TwoOrMoreLanes,Highway,State,Western,Warrumbungle,Tannabar,2357,Trafficorder Dual Tube Classifier,false,0,0,9518897,4712093,-31.314188,149.300644,9,5,true,ae2f8a932caf100b2f02ebecebdf6ac0,2018-06-12 02:48:41.978017+00
,5987,,,58709,99135,Castlereagh Highway,Castlereagh Highway,"Castlereagh Highway, North of Bolaro Street",Castlereagh Highway,North of Bolaro Street,Castlereagh,Highway,Bolaro Street,1600,0000018,2030,B,55,B55,Primary Road,OnGround,TwoOrMoreLanes,Highway,State,Western,Warrumbungle,Dunedoo,2844,Trafficorder Tube Axlepair Counter,false,0,1,9524926,4635678.5,-32.002338,149.382294,9,5,true,058a369d5a2cacd11464f65948b78a9e,2018-06-12 02:48:41.978017+00
,5988,,,55645,04459,Mullumbimby Road,Mullumbimby Road,"Mullumbimby Road, South of The Saddle Road",Mullumbimby Road,South of The Saddle Road,Mullumbimby,Road,The Saddle Road,130,0000463,0010,NULL,NULL,NULL,Arterial Road,OnGround,TwoOrMoreLanes,Road,Regional,Northern,Byron,Myocum,2481,Trafficorder Tube Axlepair Counter,false,0,1,9939629,4999051.5,-28.569139,153.526474,10,5,true,9088240efa915b8e7a95bb9089f2e15d,2018-06-12 02:48:41.978017+00
,5989,,,55465,04060,Pacific Highway,Pacific Highway,"Pacific Highway, South of Martins Lane",Pacific Highway,South of Martins Lane,Pacific,Highway,Martins Lane,390,0000010,3171,NULL,NULL,NULL,Primary Road,OnGround,TwoOrMoreLanes,Highway,State,Northern,Ballina,Knockrow,2479,Trafficorder Tube Axlepair Counter,false,0,1,9939272,4977459,-28.763359,153.536606,9,5,true,a7d694b16a81af23223082a9e52f9096,2018-06-12 02:48:41.978017+00
,5990,,,56615,10052,Syd Einfeld Drive,Syd Einfeld Drive,"Syd Einfeld Drive, East of Grosvenor Street","Syd Einfeld.syd Einfeld Dr, Bondi Junction",East of Grosvenor Street,Syd Einfeld,Drive,Grosvenor Street,40,0000172,0090,NULL,NULL,NULL,Arterial Road,OnBridge,TwoOrMoreLanes,Drive,State,Sydney,Waverley,Bondi Junction,2022,Trafficorder Dual Tube Classifier,false,1,0,9692693,4421011,-33.89072,151.250137,10,4,true,7aae1b8ebdb3b7bdc5dbd476d63e1fc6,2018-06-12 02:48:41.978017+00
,5991,,,55615,04400,Pacific Highway,Pacific Highway,"Pacific Highway, North of Causleys Lane",Pacific Highway,North of Causleys Lane,Pacific,Highway,Causleys Lane,460,0000010,2835,A,1,A1,Primary Road,OnGround,TwoOrMoreLanes,Highway,State,Northern,Clarence Valley,Gulmarrad,2463,Trafficorder Tube Axlepair Counter,false,0,1,9901700,4899556.5,-29.48439,153.200577,9,5,true,82e78eccd91c4bb7f202ec238785b0ca,2018-06-12 02:48:41.978017+00
,5992,,,58278,95349,Riverina Highway,Riverina Highway,"Riverina Highway, North of Warmata Road",Riverina Highway,North of Warmata Road,Riverina,Highway,Warmata Road,850,0000020,1220,B,58,B58,Primary Road,OnGround,TwoOrMoreLanes,Highway,State,South West,Berrigan,Savernake,2646,Trafficorder Tube Axlepair Counter,false,0,1,9207929,4225919,-35.718269,145.982407,10,5,true,0e9c5edaa46266587c4bb7d324105122,2018-06-12 02:48:41.978017+00
,5993,,,58528,97035,Newell Highway,Newell Highway,"Newell Highway, North of Jerilderie-Urana Road",Newell Highway,North of Jerilderie-Urana Road,Newell,Highway,Jerilderie-Urana Road,1200,0000017,2130,A,39,A39,Primary Road,OnGround,TwoOrMoreLanes,Highway,State,South West,Jerilderie,Jerilderie,2716,Trafficorder Tube Axlepair Counter,false,0,1,9190382,4272771,-35.294258,145.794479,9,5,true,02b348af426fab022b78af000ade5549,2018-06-12 02:48:41.978017+00
,5994,,,58210,95092,Main Street,Main Street,"Main Street, East of Fleece Street",Main Street,East of Fleece Street,Main,Street,Fleece Street,0,0000017,2460,B,64,B64,Primary Road,OnGround,TwoOrMoreLanes,Street,State,South West,Bland,West Wyalong,2671,Trafficorder Tube Axlepair Counter,false,0,0,9318566,4425493.5,-33.922207,147.200958,10,5,true,ee8fae2146fd1621cefa95474f2f7549,2018-06-12 02:48:41.978017+00
,5995,,,55958,05323,Donald Street,Donald Street,"Donald Street, North of Bibby Street","Donald.donald St, Hamilton",North of Bibby Street,Donald,Street,Bibby Street,80,0000082,0040,A,15,A15,Arterial Road,OnBridge,TwoOrMoreLanes,Street,State,Hunter,Newcastle,Hamilton,2303,Trafficorder Loop Counter,false,1,0,9742860,4526682,-32.918491,151.740524,10,4,true,56381f4e0d11c14e4dde8249933bbc93,2018-06-12 02:48:41.978017+00
,5996,,,15334020,T0245,Newell Highway,Newell Highway,"Newell Highway, North of Warrumbungles Way","Newell.newell Highway, Coonabarabran",North of Warrumbungles Way,Newell,Highway,Warrumbungles Way,1180,0000017,3060,A,39,A39,Primary Road,OnGround,TwoOrMoreLanes,Highway,State,Western,Warrumbungle,Tannabar,2357,Tirtl,false,1,1,9519126,4711971.5,-31.315237,149.30307,9,4,true,cad5045d4ce0c877d3eec7ff9d63e58a,2018-06-12 02:48:41.978017+00
,5997,,,57056,50375,Wilde Avenue,Wilde Avenue,"Wilde Avenue, North of George Khattar Lane",Wilde Avenue,North of George Khattar Lane,Wilde,Avenue,George Khattar Lane,40,-10,-10,NULL,NULL,NULL,Distributor Road,OnBridge,TwoOrMoreLanes,Avenue,Local,Sydney,Parramatta,Parramatta,2150,Trafficorder Tube Axlepair Counter,false,0,0,9670595,4430629,-33.811878,151.007217,9,5,true,7db41f5998f3994302d795de488e52ae,2018-06-12 02:48:41.978017+00
,5998,,,57333,71059,Richmond Road,Richmond Road,"Richmond Road, East of Symonds Road","Richmond.richmond Rd, Doonside",East of Symonds Road,Richmond,Road,Symonds Road,350,0000643,0121,NULL,NULL,NULL,Arterial Road,OnBridge,TwoOrMoreLanes,Road,State,Sydney,Blacktown,Glendenning,2761,Trafficorder Loop Counter,false,1,0,9657831,4438929,-33.741375,150.866013,10,4,true,aab8b60f250d7fb65bf927e208908fa7,2018-06-12 02:48:41.978017+00
,5999,,,55558,04283,Dawson Street,Dawson Street,"Dawson Street, South of Hampton Street",Dawson Street,South of Hampton Street,Dawson,Street,Hampton Street,40,0000065,0011,B,62,B62,Arterial Road,OnGround,TwoOrMoreLanes,Street,State,Northern,Lismore,Lismore,2480,Trafficorder Tube Axlepair Counter,false,0,0,9913789,4973586.5,-28.812225,153.279068,9,5,true,8775d961f1731b8d17fdc1d6ca5c9649,2018-06-12 02:48:41.978017+00
,6000,,,58334,95532,Adelong Road,Adelong Road,"Adelong Road, West of Snowy Mountains Highway",Adelong Road,West of Snowy Mountains Highway,Adelong,Road,Snowy Mountains Highway,90,0000004,0550,B,72,B72,Primary Road,OnGround,TwoOrMoreLanes,Road,State,South West,Tumut,Tumut,2720,Trafficorder Tube Axlepair Counter,false,0,0,9410453,4272657.5,-35.295193,148.214722,10,5,true,7d4f27ce4e4e7a4b431b0ff090b2bdb0,2018-06-12 02:48:41.978017+00
,6001,,,56649,16010,Southern Cross Drive,Southern Cross Drive,"Southern Cross Drive, South of Gardeners Road","Southern Cross.southern Cross Dr, Eastlakes",South of Gardeners Road,Southern Cross,Drive,Gardeners Road,60,0000593,0950,M,1,M1,Motorway,OnGround,TwoOrMoreLanes,Drive,State,Sydney,Botany Bay,Eastlakes,2018,Trafficorder Loop Counter,false,1,0,9689270,4417347,-33.925007,151.214737,9,4,true,966e310a157cf87d2a5563bfba7569e7,2018-06-12 02:48:41.978017+00
,6002,,,15286013,7164,Great Western Highway,Great Western Highway,"Great Western Highway, West of Station Street","Great Western.great Western Hwy, South Wentworthville",West of Station Street,Great Western,Highway,Station Street,20,0000005,0781,A,44,A44,Primary Road,OnGround,TwoOrMoreLanes,Highway,State,Sydney,Holroyd,South Wentworthville,2145,Tirtl,false,1,1,9667068,4430349,-33.81562,150.969238,3,5,true,71a11047f20ca636d306dcfb74d284f7,2018-06-12 02:48:41.978017+00
,6003,,,56391,07803,Princes Highway,Princes Highway,"Princes Highway, East of Tannery Road",Princes Highway,East of Tannery Road,Princes,Highway,Tannery Road,680,0000001,1480,A,1,A1,Primary Road,OnGround,TwoOrMoreLanes,Highway,State,Southern,Shoalhaven,Berry,2535,Trafficorder Tube Axlepair Counter,false,0,1,9639293,4325511.5,-34.770016,150.709396,9,5,true,e9048a098d4df81e5ae8ba8580af80c2,2018-06-12 02:48:41.978017+00
,6004,,,56109,05645,Main Road,Main Road,"Main Road, East of Brisbane Street",Noraville Road,East of Brisbane Street,Main,Road,Brisbane Street,70,0000509,0060,B,70,B70,Arterial Road,OnGround,TwoOrMoreLanes,Road,State,Hunter,Wyong,Noraville,2263,Trafficorder Tube Axlepair Counter,false,0,0,9724277,4488634.5,-33.268997,151.559631,7,5,true,bf80c4bbbf7c1cf002908ff104876de8,2018-06-12 02:48:41.978017+00
,6005,,,15252011,6169,Mitchell Highway,Mitchell Highway,"Mitchell Highway, North of Shreeves Road","Mitchell.wellington Rd, Molong",North of Shreeves Road,Mitchell,Highway,Shreeves Road,1330,0000007,0405,A,32,A32,Primary Road,OnGround,TwoOrMoreLanes,Highway,State,Western,Cabonne,Molong,2866,Tirtl,false,1,1,9473757,4520334.5,-33.052498,148.862244,9,4,true,862055fb5ca92710ab61fc35e75f4225,2018-06-12 02:48:41.978017+00
,6006,,,56841,29005,Concord Road,Concord Road,"Concord Road, North of Llewellyn Street","Concord.concord Rd, Rhodes",North of Llewellyn Street,Concord,Road,Llewellyn Street,20,0000200,0420,A,3,A3,Arterial Road,OnGround,TwoOrMoreLanes,Road,State,Sydney,Canada Bay,Rhodes,2138,Tirtl,false,1,1,9678489,4428901.5,-33.824696,151.093216,9,5,true,62513f373411288583b445c838f38e24,2018-06-12 02:48:41.978017+00
,6007,,,58150,94479,Bungendore Road,Bungendore Road,"Bungendore Road, North of Brooks Road",Bungendore Road,North of Brooks Road,Bungendore,Road,Brooks Road,260,-10,-10,NULL,NULL,NULL,Sub-Arterial Road,OnGround,TwoOrMoreLanes,Road,Local,Southern,Palerang,Bywong,2621,Trafficorder Tube Axlepair Counter,false,0,1,9513024,4286444,-35.15517,149.339096,10,5,true,84145d81af340578445a3daefdf35bed,2018-06-12 02:48:41.978017+00
,6008,,,58294,95395,Burley Griffin Way,Burley Griffin Way,"Burley Griffin Way, West of Smiths Lane",Burley Griffin Way,West of Smiths Lane,Burley Griffin,Way,Smiths Lane,920,0000084,0190,B,94,B94,Arterial Road,OnGround,TwoOrMoreLanes,Way,State,South West,Temora,Springdale,2666,Trafficorder Tube Axlepair Counter,false,0,1,9371525,4363862,-34.476021,147.779144,10,5,true,89dee1230769f428a016963bb1e2b973,2018-06-12 02:48:41.978017+00
,6009,,,55499,04162,Paperbark Close,Paperbark Close,"Paperbark Close, South of Teven Road",Paperbark Close,South of Teven Road,Paperbark,Close,Teven Road,90,0230146,0015,NULL,NULL,NULL,Local Road,OnGround,TwoOrMoreLanes,Close,Local,Northern,Ballina,West Ballina,2478,Trafficorder Tube Axlepair Counter,false,0,1,9937039,4967023,-28.858402,153.520493,9,5,true,0f746ada14f62b2bd5068c4497adecaa,2018-06-12 02:48:41.978017+00
,6010,,,56135,05674,Carnley Avenue,Carnley Avenue,"Carnley Avenue, East of Charlestown Road",Carnley Avenue,East of Charlestown Road,Carnley,Avenue,Charlestown Road,90,0000603,0030,NULL,NULL,NULL,Arterial Road,OnGround,TwoOrMoreLanes,Avenue,Regional,Hunter,Newcastle,Kotara,2289,Trafficorder Tube Axlepair Counter,false,0,0,9737954,4524487.5,-32.940269,151.689133,10,5,true,2e0c33e580eacea85f754d9211ec2797,2018-06-12 02:48:41.978017+00
,6011,,,55857,05192,Showground Road,Showground Road,"Showground Road, South of Bellbowrie Avenue",Showground Road,South of Bellbowrie Avenue,Showground,Road,Bellbowrie Avenue,10,-10,-10,NULL,NULL,NULL,Distributor Road,OnGround,TwoOrMoreLanes,Road,Local,Hunter,Gosford,Narara,2250,Trafficorder Tube Axlepair Counter,false,0,0,9703742,4474605,-33.403389,151.345474,9,5,true,3d1fe83dc2e728c4819fa276ad12885b,2018-06-12 02:48:41.978017+00
,6012,,,58127,94342,Albury Street,Albury Street,"Albury Street, West of Bundarbo Street",Burley Griffin Way,West of Bundarbo Street,Albury,Street,Bundarbo Street,20,0000084,0120,B,94,B94,Arterial Road,OnGround,TwoOrMoreLanes,Way,State,South West,Harden,Harden,2587,Trafficorder Tube Axlepair Counter,false,0,1,9426510,4354195,-34.558098,148.379456,10,5,true,d7d78aca682cad1087433c1b55b2b274,2018-06-12 02:48:41.978017+00
,6013,,,58121,94296,Goulburn Street,Goulburn Street,"Goulburn Street, South of Showground Lane",Goulburn Road,South of Showground Lane,Goulburn,Street,Showground Lane,50,0000054,0080,NULL,NULL,NULL,Arterial Road,OnGround,TwoOrMoreLanes,Road,State,Southern,Upper Lachlan,Crookwell,2583,Trafficorder Tube Axlepair Counter,false,0,1,9527553,4362701,-34.464546,149.478699,9,5,true,d07c013e021dbfcd88db282381845e0d,2018-06-12 02:48:41.978017+00
,6014,,,56678,18011,Princes Highway,Princes Highway,"Princes Highway, West of Yelverton Street","Princes.princes Hwy, St Peters",West of Yelverton Street,Princes,Highway,Yelverton Street,30,0000001,0210,A,36,A36,Primary Road,OnGround,TwoOrMoreLanes,Highway,State,Sydney,Marrickville,Sydenham,2044,Excel Pp,false,1,1,9685279,4418305.5,-33.917812,151.171143,5,4,true,9fe89d3b5d517088ee07e4713ab264dc,2018-06-12 02:48:41.978017+00
,6015,,,56117,05650,Medowie Road,Medowie Road,"Medowie Road, South of Townsend Avenue",Medowie Road,South of Townsend Avenue,Medowie,Road,Townsend Avenue,100,0000518,0010,NULL,NULL,NULL,Arterial Road,OnGround,TwoOrMoreLanes,Road,Regional,Hunter,Port Stephens,Williamtown,2318,Trafficorder Tube Axlepair Counter,false,0,1,9753831,4539210,-32.800995,151.851578,9,5,true,2ff90f3cb381a4a52a370f5f520a49c4,2018-06-12 02:48:41.978017+00
,6016,,,57662,91606,New England Highway,New England Highway,"New England Highway, North of Ross Road",New England Highway,North of Ross Road,New England,Highway,Ross Road,1690,0000009,1320,A,15,A15,Primary Road,OnGround,TwoOrMoreLanes,Highway,State,Northern,Glen Innes Severn,Glencoe,2365,Trafficorder Tube Axlepair Counter,false,0,1,9755043,4849203,-30.006659,151.715042,9,5,true,52a74840f5e15472a64f33b7e36f89dc,2018-06-12 02:48:41.978017+00
,6017,,,58329,95506,Batlow Road,Batlow Road,"Batlow Road, North of Bago Forest Road",Batlow Road,North of Bago Forest Road,Batlow,Road,Bago Forest Road,220,0000085,0080,NULL,NULL,NULL,Arterial Road,OnGround,TwoOrMoreLanes,Road,State,South West,Tumbarumba,Tumbarumba,2653,Trafficorder Tube Axlepair Counter,false,0,1,9394807,4226259,-35.714962,148.04779,9,5,true,f45f4675946d84498e0513fe4b28c7f6,2018-06-12 02:48:41.978017+00
,6018,,,57360,7168RLC,Great Western Highway,Great Western Highway,"Great Western Highway, East of Reservoir Road",Great Western Highway,East of Reservoir Road,Great Western,Highway,Reservoir Road,10,0000005,0880,A,44,A44,Primary Road,OnGround,TwoOrMoreLanes,Highway,State,Sydney,Blacktown,Blacktown,2148,Tirtl,false,1,1,9660476,4432529,-33.798203,150.897141,7,5,true,b2d34ec247578765e79a911266fac657,2018-06-12 02:48:41.978017+00
,6019,,,58390,9572,New England Highway,New England Highway,"New England Highway, South of Lowestoft Road","New England.new England Highway, Wallabadah",South of Lowestoft Road,New England,Highway,Lowestoft Road,930,0000009,0850,A,15,A15,Primary Road,OnGround,TwoOrMoreLanes,Highway,State,Northern,Liverpool Plains,Wallabadah,2343,Excel Pp,false,1,1,9666680,4691608,-31.459629,150.860687,9,4,true,5e6ac30099e134a1f2b3bccb59f107f1,2018-06-12 02:48:41.978017+00
,6020,,,57395,73038,Old Northern Road,Old Northern Road,"Old Northern Road, South of Malabar Road","Old Northern.old Northern Rd, Glenhaven",South of Malabar Road,Old Northern,Road,Malabar Road,40,0000160,0150,NULL,NULL,NULL,Arterial Road,OnGround,TwoOrMoreLanes,Road,State,Sydney,Hornsby,Dural,2158,Excel Lpl,false,1,1,9671848,4443028,-33.699642,151.01561,9,4,true,b58b663e544e41f2afb2ba3494bceb36,2018-06-12 02:48:41.978017+00
,6021,,,55376,02367,Bourke Street,Bourke Street,"Bourke Street, North of Parkham Street",Bourke Street,North of Parkham Street,Bourke,Street,Parkham Street,10,-10,-10,NULL,NULL,NULL,Local Road,OnGround,TwoOrMoreLanes,Street,Local,Sydney,Sydney,Surry Hills,2010,Trafficorder Tube Axlepair Counter,false,0,0,9689442,4421211,-33.89011,151.214905,5,5,true,4e1e0104825f49294300ad5b71da7658,2018-06-12 02:48:41.978017+00
,6022,,,328011,93114,Mid Western Highway,Mid Western Highway,"Mid Western Highway, East of Bimbella Street",Mid Western Highway,East of Bimbella Street,Mid Western,Highway,Bimbella Street,1890,0000006,0615,B,64,B64,Primary Road,OnGround,TwoOrMoreLanes,Highway,State,Western,Weddin,Caragabal,2810,Trafficorder Dual Tube Classifier,false,0,1,9350526,4443551,-33.758228,147.545868,10,5,true,a994c13ff67ee78dbf38731a9b2b5e07,2018-06-12 02:48:41.978017+00
,6023,,,55938,05304,Newcastle Inner City Bypass,Newcastle Inner City Bypass,"Newcastle Inner City Bypass, West of Teal Court",Charleston Bypass,West of Teal Court,Newcastle Inner City,Bypass,Teal Court,160,0000023,0810,A,37,A37,Arterial Road,OnGround,TwoOrMoreLanes,Bypass,State,Hunter,Lake Macquarie,Hillsborough,2290,Trafficorder Tube Axlepair Counter,false,0,1,9736623,4521157.5,-32.970833,151.676498,9,5,true,4a4893a1390d6384df2ca7ec62d42fbd,2018-06-12 02:48:41.978017+00
,6024,,,57835,93090,Mitchell Highway,Mitchell Highway,"Mitchell Highway, North of Favell Road",Mitchell Highway,North of Favell Road,Mitchell,Highway,Favell Road,900,0000007,0110,A,32,A32,Primary Road,OnGround,TwoOrMoreLanes,Highway,State,Western,Orange,Lucknow,2800,Trafficorder Dual Tube Classifier,false,0,1,9502486,4485418,-33.362549,149.177856,10,5,true,d329619b7fe08bb49b25b529213fabf4,2018-06-12 02:48:41.978017+00
,6025,,,58481,96370,Richard Street,Richard Street,"Richard Street, North of Gorrell Avenue",Gorrell Avenue,North of Gorrell Avenue,Richard,Street,Gorrell Avenue,30,0000421,0140,B,87,B87,Primary Road,OnGround,TwoOrMoreLanes,Avenue,State,Western,Bourke,Bourke,2840,Trafficorder Dual Tube Classifier,false,0,0,9197451,4849104.5,-30.095442,145.936707,9,5,true,a757a05d1787896927a5ebb3960a8ddd,2018-06-12 02:48:41.978017+00
,6026,,,58485,96382,Bathurst Street,Bathurst Street,"Bathurst Street, East of Kamilaroi Highway",Kamilaroi Highway,East of Kamilaroi Highway,Bathurst,Street,Kamilaroi Highway,30,0000029,0730,B,76,B76,Arterial Road,OnGround,TwoOrMoreLanes,Highway,State,Western,Brewarrina,Brewarrina,2839,Trafficorder Dual Tube Classifier,false,0,1,9285758,4864701.5,-29.959442,146.852554,10,5,true,9e3990ee007c739ac8b9a4296a93eed5,2018-06-12 02:48:41.978017+00
,6027,,,55980,05400,Nelson Bay Road,Nelson Bay Road,"Nelson Bay Road, East of Gan Gan Road",Nelson Bay Road,East of Gan Gan Road,Nelson Bay,Road,Gan Gan Road,1290,0000108,0140,B,63,B63,Arterial Road,OnGround,TwoOrMoreLanes,Road,State,Hunter,Port Stephens,Anna Bay,2316,Trafficorder Tube Axlepair Counter,false,0,1,9775996,4542360.5,-32.763077,152.086517,10,5,true,a86c457f01628a578e0eb33176f4692d,2018-06-12 02:48:41.978017+00
,6028,,,58581,97232,Perricoota Road,Perricoota Road,"Perricoota Road, West of Boundary Road",Perricoota Road,West of Boundary Road,Perricoota,Road,Boundary Road,90,-10,-10,NULL,NULL,NULL,Arterial Road,OnGround,TwoOrMoreLanes,Road,Local,South West,Murray,Moama,2731,Trafficorder Tube Axlepair Counter,false,0,1,9096670,4181281,-36.104759,144.742371,9,5,true,0cf227b4583cd57d9b1a67d4447a5b08,2018-06-12 02:48:41.978017+00
,6029,,,57915,93417,The Escort Way,The Escort Way,"The Escort Way, West of West Street",The Escort Way,West of West Street,The Escort Way,,West Street,1230,0000377,0060,NULL,NULL,NULL,Arterial Road,OnGround,TwoOrMoreLanes,,State,Western,Cabonne,Cudal,2864,Trafficorder Dual Tube Classifier,false,0,0,9459700,4494244.5,-33.2901,148.716217,10,5,true,9a9cf49a7586b34d80ac691df580a0e5,2018-06-12 02:48:41.978017+00
,6030,,,58325,95486,Hammond Avenue,Hammond Avenue,"Hammond Avenue, East of Lake Albert Road",Hammond Avenue,East of Lake Albert Road,Hammond,Avenue,Lake Albert Road,100,0000014,0080,A,20,A20,Primary Road,OnGround,TwoOrMoreLanes,Avenue,State,South West,Wagga Wagga,East Wagga Wagga,2650,Trafficorder Tube Axlepair Counter,false,0,0,9334577,4292622.5,-35.120396,147.379486,10,5,true,81cfd8703059421e2679a50f060e71c7,2018-06-12 02:48:41.978017+00
,6031,,,57106,53005,Ryde Road,Ryde Road,"Ryde Road, South of Lofberg Road","Ryde.ryde Rd, West Pymble",South of Lofberg Road,Ryde,Road,Lofberg Road,30,0000162,0120,A,3,A3,Arterial Road,OnGround,TwoOrMoreLanes,Road,State,Sydney,Ku-Ring-Gai,West Pymble,2073,Excel Lpl,false,1,1,9682801,4435497.5,-33.763687,151.136978,9,4,true,100683f8e0686001e25dba3e6b50f016,2018-06-12 02:48:41.978017+00
,6032,,,57263,68019,Great Western Highway,Great Western Highway,"Great Western Highway, East of Emert Street",Great Western Highway,East of Emert Street,Great Western,Highway,Emert Street,60,0000005,0781,A,44,A44,Primary Road,OnGround,TwoOrMoreLanes,Highway,State,Sydney,Holroyd,Wentworthville,2145,Trafficorder Loop Counter,false,1,0,9666702,4430476,-33.814598,150.965225,10,5,true,097016caf514c683cfe29328af1eea17,2018-06-12 02:48:41.978017+00
