,6866,,,55367,02359,Anzac Parade,Anzac Parade,"Anzac Parade, South of Alison Road",Anzac Parade,South of Alison Road,Anzac,Parade,Alison Road,60,0000171,0210,NULL,NULL,NULL,Arterial Road,OnGround,TwoOrMoreLanes,Parade,State,Sydney,Randwick,Kensington,2033,Trafficorder Dual Tube Classifier,false,0,0,9690124,4419852,-33.902111,151.22287,9,5,true,5013e38ce8d150ac8e8d2ed318492941,2018-06-12 02:48:41.978017+00
,6867,,,57666,92001,New England Highway,New England Highway,"New England Highway, South of Goonoo Goonoo Road",New England Highway,South of Goonoo Goonoo Road,New England,Highway,Goonoo Goonoo Road,700,0000009,0880,A,15,A15,Primary Road,OnGround,TwoOrMoreLanes,Highway,State,Northern,Tamworth Regional,Calala,2340,Trafficorder Dual Tube Classifier,false,0,1,9673509,4723231.5,-31.172205,150.920029,9,5,true,93b5de18aa43a2aa0f1c1521399f0bb4,2018-06-12 02:48:41.978017+00
,6868,,,57643,91506,Bruxner Highway,Bruxner Highway,"Bruxner Highway, South of Merriwa Street",Bruxner Highway,South of Merriwa Street,Bruxner,Highway,Merriwa Street,370,0000462,0720,NULL,NULL,NULL,Primary Road,OnGround,TwoOrMoreLanes,Highway,Regional,Western,Moree Plains,Boggabilla,2409,Trafficorder Dual Tube Classifier,false,0,1,9629781,5008357.5,-28.617474,150.365082,10,5,true,8fadeebe9862796f03fe23ecdc020a0e,2018-06-12 02:48:41.978017+00
,6869,,,58072,94091,Lachlan Valley Way,Lachlan Valley Way,"Lachlan Valley Way, North of Murringo Road",Lachlan Valley Way,North of Murringo Road,Lachlan Valley,Way,Murringo Road,100,0000056,0090,B,81,B81,Arterial Road,OnGround,TwoOrMoreLanes,Way,State,South West,Boorowa,Boorowa,2586,Trafficorder Tube Axlepair Counter,false,0,1,9455936,4368409.5,-34.425968,148.697754,9,5,true,7e91c4ef01acb393bc658642cd1f130d,2018-06-12 02:48:41.978017+00
,6870,,,58209,95090,Newell Highway,Newell Highway,"Newell Highway, South of Mid Western Highway",Newell Highway,South of Mid Western Highway,Newell,Highway,Mid Western Highway,450,0000017,2490,B,64,B64,Primary Road,OnGround,TwoOrMoreLanes,Highway,State,Western,Weddin,Caragabal,2810,Trafficorder Tube Axlepair Counter,false,0,1,9348235,4443202,-33.76149,147.521133,9,5,true,9096f054263fedd4479d63fd13c15d57,2018-06-12 02:48:41.978017+00
,6871,,,58616,97352,Barooga-Tocumwal Road,Barooga-Tocumwal Road,"Barooga-Tocumwal Road, East of Mcintyre Field View Road",Corowa-Tocumwal Road,East of Mcintyre Field View Road,Barooga-Tocumwal,Road,Mcintyre Field View Road,260,0000550,0110,NULL,NULL,NULL,Arterial Road,OnGround,TwoOrMoreLanes,Road,Regional,South West,Berrigan,Tocumwal,2714,Trafficorder Tube Axlepair Counter,false,0,1,9173684,4213175,-35.829552,145.602081,10,5,true,e5b0c16dd616b1fd89e2ac00333a1b73,2018-06-12 02:48:41.978017+00
,6872,,,15648002,9849,The Boulevarde,The Boulevarde,"The Boulevarde, North of Torrington Road","The Boulevarde.the Boulevarde, Enfield",North of Torrington Road,The Boulevarde,,Torrington Road,30,0000668,0020,NULL,NULL,NULL,Local Road,OnGround,TwoOrMoreLanes,,State,Sydney,Strathfield,Strathfield,2135,Tirtl,false,1,1,9678254,4423001.5,-33.877975,151.093185,9,5,true,aa59635e74f18f11d37cd599c0fbbee3,2018-06-12 02:48:41.978017+00
,6873,,,55705,04683,Ballina Road,Ballina Road,"Ballina Road, East of Conway Street",Bruxner Highway,East of Conway Street,Ballina,Road,Conway Street,80,0000016,0165,B,60,B60,Primary Road,OnGround,TwoOrMoreLanes,Highway,State,Northern,Lismore,East Lismore,2480,Trafficorder Tube Axlepair Counter,false,0,0,9914169,4973279,-28.814785,153.283127,10,5,true,bca2d34ed495197e85c0dcb002d5442c,2018-06-12 02:48:41.978017+00
,6874,,,56728,21022,Falcon Street,Falcon Street,"Falcon Street, West of Bardsley Gardens",Falcon Street,West of Bardsley Gardens,Falcon,Street,Bardsley Gardens,10,0000164,0135,NULL,NULL,NULL,Arterial Road,OnGround,TwoOrMoreLanes,Street,State,Sydney,North Sydney,North Sydney,2060,Trafficorder Tube Axlepair Counter,false,0,0,9689264,4427985.5,-33.82909,151.210037,10,5,true,b78c1963f39b05dbd3f3578c3adf761e,2018-06-12 02:48:41.978017+00
,6875,,,58374,95645,Jondaryan Avenue,Jondaryan Avenue,"Jondaryan Avenue, East of Banna Lane",Kidman Way,East of Banna Lane,Jondaryan,Avenue,Banna Lane,0,0000321,0170,B,87,B87,Arterial Road,OnGround,TwoOrMoreLanes,Way,State,South West,Griffith,Griffith,2680,Trafficorder Tube Axlepair Counter,false,0,0,9212641,4384445,-34.289154,146.050415,9,5,true,c6f5a82886809887fd711e6183927019,2018-06-12 02:48:41.978017+00
,6876,,,58848,99921,Great Western Highway,Great Western Highway,"Great Western Highway, West of Glanmire Lane",Great Western Highway,West of Glanmire Lane,Great Western,Highway,Glanmire Lane,1480,0000005,1720,A,32,A32,Primary Road,OnGround,TwoOrMoreLanes,Highway,State,Western,Bathurst Regional,Glanmire,2795,Trafficorder Dual Tube Classifier,false,0,1,9550046,4477285,-33.425926,149.691452,10,5,true,4edde25746f99a39719dbe55c1aae258,2018-06-12 02:48:41.978017+00
,6877,,,56916,37005,Princes Highway,Princes Highway,"Princes Highway, North of Yanagang Street","Princes.princes Hwy, Heathcote",North of Yanagang Street,Princes,Highway,Yanagang Street,80,0000001,0630,A,1,A1,Primary Road,OnGround,TwoOrMoreLanes,Highway,State,Sydney,Sutherland,Waterfall,2233,Trafficorder Loop Counter,false,1,0,9667993,4395169.5,-34.132504,150.993759,9,4,true,a31a4aa1df8b824d7b7ea688b90ea13b,2018-06-12 02:48:41.978017+00
,6878,,,56427,08089,Snowy Mountains Highway,Snowy Mountains Highway,"Snowy Mountains Highway, South of Yarrangobilly Caves Exit Road",Snowy Mountains Highway,South of Yarrangobilly Caves Exit Road,Snowy Mountains,Highway,Yarrangobilly Caves Exit Road,820,0000004,0391,B,72,B72,Primary Road,OnGround,TwoOrMoreLanes,Highway,State,Southern,Snowy River,Kosciuszko National Park,2627,Trafficorder Tube Axlepair Counter,false,0,1,9437316,4221608,-35.752174,148.51828,9,5,true,28b23e23de00bf28eacde7bcd67262ee,2018-06-12 02:48:41.978017+00
,6879,,,58833,99894,Castlereagh Highway,Castlereagh Highway,"Castlereagh Highway, West of Old Mill Road",Castlereagh Highway,West of Old Mill Road,Castlereagh,Highway,Old Mill Road,790,0000018,1260,B,55,B55,Primary Road,OnGround,TwoOrMoreLanes,Highway,State,Western,Mid-Western Regional,Gulgong,2852,Trafficorder Dual Tube Classifier,false,0,1,9534696,4596906.5,-32.350094,149.495544,10,5,true,be1c8735fd4ab15bd9fcda5e6c12e26d,2018-06-12 02:48:41.978017+00
,6880,,,57377,72083,Renown Road,Renown Road,"Renown Road, West of Barclay Road","Renown.renown Rd, Baulkham Hills",West of Barclay Road,Renown,Road,Barclay Road,270,0007143,0020,NULL,NULL,NULL,Distributor Road,OnGround,TwoOrMoreLanes,Road,Regional,Sydney,The Hills,North Rocks,2151,Trafficorder Loop Counter,false,1,0,9670970,4435801,-33.765114,151.009125,10,5,true,c5606190597437b20df5cd319b7bf430,2018-06-12 02:48:41.978017+00
,6881,,,55728,05016,Mccaffrey Drive,Mccaffrey Drive,"Mccaffrey Drive, West of Lookout Road",Mccaffrey Drive,West of Lookout Road,Mccaffrey,Drive,Lookout Road,100,0007770,0010,NULL,NULL,NULL,Distributor Road,OnGround,TwoOrMoreLanes,Drive,Regional,Hunter,Newcastle,New Lambton Heights,2305,Trafficorder Tube Axlepair Counter,false,0,0,9738334,4525775.5,-32.928505,151.692581,10,5,true,332af87561b7fdb34384f5338737ce47,2018-06-12 02:48:41.978017+00
,6882,,,56983,44024,Milperra Road,Milperra Road,"Milperra Road, North of Victoria Street",Milperra Road,North of Victoria Street,Milperra,Road,Victoria Street,10,0000167,0420,A,34,A34,Arterial Road,OnGround,TwoOrMoreLanes,Road,State,Sydney,Bankstown,Revesby,2212,Trafficorder Dual Tube Classifier,false,0,0,9671017,4416599,-33.93824,151.017609,10,5,true,ebba5195349c8f21e1ea662df7bb1d4a,2018-06-12 02:48:41.978017+00
,6883,,,55744,05037,New England Highway,New England Highway,"New England Highway, South of Lemington Road",New England Highway,South of Lemington Road,New England,Highway,Lemington Road,490,0000009,0470,A,15,A15,Primary Road,OnBridge,TwoOrMoreLanes,Highway,State,Hunter,Singleton,Ravensworth,2330,Trafficorder Tube Axlepair Counter,false,0,1,9682195,4579877.5,-32.461887,151.069687,9,5,true,276a5e1d89c022030458966b932fdd66,2018-06-12 02:48:41.978017+00
,6884,,,55449,04030,Ballina Road,Ballina Road,"Ballina Road, East of Bruxner Crescent",Bruxner Highway,East of Bruxner Crescent,Ballina,Road,Bruxner Crescent,10,0000016,0150,B,60,B60,Primary Road,OnGround,TwoOrMoreLanes,Highway,State,Northern,Lismore,Goonellabah,2480,Trafficorder Tube Axlepair Counter,false,0,0,9917289,4973095,-28.814747,153.315079,10,5,true,c61c602cf53a7448e5d7e3a9ba271949,2018-06-12 02:48:41.978017+00
,6885,,,58537,97052,Sturt Highway,Sturt Highway,"Sturt Highway, East of Maude Road",Sturt Highway,East of Maude Road,Sturt,Highway,Maude Road,980,0000014,0400,A,20,A20,Primary Road,OnGround,TwoOrMoreLanes,Highway,State,South West,Hay,Maude,2711,Trafficorder Tube Axlepair Counter,false,0,0,9052452,4343743,-34.631035,144.298248,10,5,true,f4aed90205407aa069297f68f6b989da,2018-06-12 02:48:41.978017+00
,6886,,,57856,93222,Grenfell Road,Grenfell Road,"Grenfell Road, West of Kendal Street",Grenfell Road,West of Kendal Street,Grenfell,Road,Kendal Street,70,0000006,0340,B,81,B81,Primary Road,OnBridge,TwoOrMoreLanes,Road,State,Western,Cowra,Cowra,2794,Trafficorder Tube Axlepair Counter,false,0,0,9455869,4434025,-33.834034,148.685486,10,5,true,1a6bfca2920189fb5bf064cc159e3647,2018-06-12 02:48:41.978017+00
,6887,,,55390,02382,Bridge Road,Bridge Road,"Bridge Road, West of Ross Street",Pyrmont Bridge Road,West of Ross Street,Bridge,Road,Ross Street,60,0000523,0080,NULL,NULL,NULL,Arterial Road,OnGround,TwoOrMoreLanes,Road,State,Sydney,Sydney,Forest Lodge,2037,Trafficorder Tube Axlepair Counter,false,0,0,9686421,4422170,-33.882557,151.181824,10,5,true,93aea57a809097942ec9fdfa95dae780,2018-06-12 02:48:41.978017+00
,6888,,,15334028,T0264,Pacific Highway,Pacific Highway,"Pacific Highway, South of Yamba Road","Pacific.pacific Highway, Harwood Island",South of Yamba Road,Pacific,Highway,Yamba Road,140,0000010,2886,A,1,A1,Primary Road,OnGround,TwoOrMoreLanes,Highway,State,Northern,Clarence Valley,Maclean,2463,Tirtl,false,1,1,9905920,4904859,-29.434433,153.240707,9,4,true,fb43b1926e20e249993dc2a677c742fe,2018-06-12 02:48:41.978017+00
,6889,,,56431,08098,Kosciuszko Road,Kosciuszko Road,"Kosciuszko Road, North of Hatchery Bay Road","Kosciuszko.kosciuszko Road, Jindabyne",North of Hatchery Bay Road,Kosciuszko,Road,Hatchery Bay Road,2600,0000286,0140,NULL,NULL,NULL,Arterial Road,OnGround,TwoOrMoreLanes,Road,State,Southern,Snowy River,Kosciuszko National Park,2627,Trafficorder Loop Counter,false,1,0,9442494,4153536.25,-36.364735,148.58696,10,4,true,4b431d578ef7bd7fd71fda6c2efaa4ae,2018-06-12 02:48:41.978017+00
,6890,,,58368,95625,Broadway,Broadway,"Broadway, North of Seignior Street",Broadway Street,North of Seignior Street,Broadway,,Seignior Street,110,0000243,0200,NULL,NULL,NULL,Arterial Road,OnGround,TwoOrMoreLanes,Street,Regional,South West,Junee,Junee,2663,Trafficorder Tube Axlepair Counter,false,0,0,9353276,4320529.5,-34.86795,147.582993,9,5,true,62df0a8fe7ac2da0195f0c59503243ce,2018-06-12 02:48:41.978017+00
,6891,,,57581,91122,Phelhampton Crescent,Phelhampton Crescent,"Phelhampton Crescent, North of Carpenter Lane",New England Highway,North of Carpenter Lane,Phelhampton,Crescent,Carpenter Lane,50,0000009,1550,A,15,A15,Primary Road,OnGround,TwoOrMoreLanes,Highway,State,Northern,Tenterfield,Jennings,4383,Trafficorder Tube Axlepair Counter,false,0,1,9781282,4968043.5,-28.92605,151.928467,9,5,true,01aee3f1e304ea45f51a65d7a15de6db,2018-06-12 02:48:41.978017+00
,6892,,,55460,04045,Lismore Road,Lismore Road,"Lismore Road, West of Binna Burra Road",Lismore - Bangalow Road,West of Binna Burra Road,Lismore,Road,Binna Burra Road,1110,0000065,0102,B,62,B62,Arterial Road,OnGround,TwoOrMoreLanes,Road,State,Northern,Byron,Nashua,2479,Trafficorder Tube Axlepair Counter,false,0,0,9934277,4982920,-28.717081,153.482208,10,5,true,13a404b5427c7f459b4f28e22be212fc,2018-06-12 02:48:41.978017+00
,6893,,,55878,05207,Maud Street,Maud Street,"Maud Street, East of Lorna Street","Maud.maud St, Mayfield West",East of Lorna Street,Maud,Street,Lorna Street,40,0000605,0010,NULL,NULL,NULL,Arterial Road,OnGround,TwoOrMoreLanes,Street,State,Hunter,Newcastle,Waratah,2298,Trafficorder Loop Counter,false,1,0,9741070,4529244.5,-32.896118,151.720154,9,4,true,300a975ebb498c2a17f3cd074b071da7,2018-06-12 02:48:41.978017+00
,6894,,,58163,94502,Jugiong Road,Jugiong Road,"Jugiong Road, South of East Street",Jugiong Road,South of East Street,Jugiong,Road,East Street,100,0000381,0040,NULL,NULL,NULL,Arterial Road,OnGround,TwoOrMoreLanes,Road,Regional,South West,Harden,Murrumburrah,2587,Trafficorder Tube Axlepair Counter,false,0,1,9424179,4352862.5,-34.570393,148.354233,9,5,true,c952e5c8711413f4c6d04859582e251a,2018-06-12 02:48:41.978017+00
,6895,,,58593,97273,Hughes Street,Hughes Street,"Hughes Street, West of Quicks Road",Hughes Street,West of Quicks Road,Hughes,Street,Quicks Road,230,-10,-10,NULL,NULL,NULL,Local Road,OnGround,TwoOrMoreLanes,Street,Local,South West,Berrigan,Barooga,3644,Trafficorder Tube Axlepair Counter,false,0,1,9183246,4203932,-35.913952,145.706635,10,5,true,5b14f27697cf7d04d824115703a3a1fc,2018-06-12 02:48:41.978017+00
,6896,,,57576,91068,Gwydir Highway,Gwydir Highway,"Gwydir Highway, West of Ferguson Street",Gwydir Highway,West of Ferguson Street,Gwydir,Highway,Ferguson Street,40,0000012,0310,B,76,B76,Primary Road,OnBridge,TwoOrMoreLanes,Highway,State,Northern,Glen Innes Severn,Glen Innes,2370,Trafficorder Tube Axlepair Counter,false,0,1,9755989,4879704.5,-29.731607,151.710587,10,5,true,a30055872bb343c71d8740cc297e57b0,2018-06-12 02:48:41.978017+00
,6897,,,57848,93144,Castlereagh Highway,Castlereagh Highway,"Castlereagh Highway, West of River Edge Road",Castlereagh Highway,West of River Edge Road,Castlereagh,Highway,River Edge Road,60,0000018,2130,B,55,B55,Primary Road,OnGround,TwoOrMoreLanes,Highway,State,Western,Gilgandra,Gilgandra,2827,Trafficorder Dual Tube Classifier,false,0,1,9458855,4669112,-31.712261,148.676971,10,5,true,b00645bd6b6edca70e5a7aa294482b3c,2018-06-12 02:48:41.978017+00
,6898,,,55927,05289,Adelaide Street,Adelaide Street,"Adelaide Street, East of William Street",Adelaide Street,East of William Street,Adelaide,Street,William Street,100,-10,-10,NULL,NULL,NULL,Arterial Road,OnGround,TwoOrMoreLanes,Street,Local,Hunter,Port Stephens,Raymond Terrace,2324,Trafficorder Tube Axlepair Counter,false,0,0,9744128,4543857,-32.763119,151.745727,9,5,true,7b52ab032454d019dbd83dd4adbb6516,2018-06-12 02:48:41.978017+00
,6899,,,57250,66240,The Horsley Drive,The Horsley Drive,"The Horsley Drive, North of Fairfield Street","The Horsley.the Horsley Dr, Fairfield",North of Fairfield Street,The Horsley Drive,,Fairfield Street,40,0000609,0055,NULL,NULL,NULL,Arterial Road,OnBridge,TwoOrMoreLanes,Drive,State,Sydney,Fairfield,Fairfield,2165,Trafficorder Loop Counter,false,1,0,9666083,4424336,-33.870174,150.96106,9,5,true,0a712d7d66fd2fb259bea4ec215a2184,2018-06-12 02:48:41.978017+00
,6900,,,57622,91380,Heber Street,Heber Street,"Heber Street, West of Roslyn Lane",Heber Street,West of Roslyn Lane,Heber,Street,Roslyn Lane,30,-10,-10,NULL,NULL,NULL,Primary Road,OnGround,TwoOrMoreLanes,Street,Local,Western,Moree Plains,Moree,2400,Trafficorder Tube Axlepair Counter,false,0,0,9575840,4916044.5,-29.46298,149.840576,10,5,true,fa0d7692132cb14a9a038536a17cc612,2018-06-12 02:48:41.978017+00
,6901,,,55738,05029,Minmi Road,Minmi Road,"Minmi Road, East of Prestwick Street",Minmi Road,East of Prestwick Street,Minmi,Road,Prestwick Street,240,-10,-10,NULL,NULL,NULL,Sub-Arterial Road,OnGround,TwoOrMoreLanes,Road,Local,Hunter,Newcastle,Fletcher,2287,Trafficorder Tube Axlepair Counter,false,0,1,9734270,4531884,-32.875069,151.646225,10,5,true,7e8a304042b60bc57867a93096b90c39,2018-06-12 02:48:41.978017+00
,6902,,,58874,F3FWY005,Pacific Motorway,Pacific Motorway,"Pacific Motorway, West of Peats Ridge Road",Pacific Motorway,West of Peats Ridge Road,Pacific,Motorway,Peats Ridge Road,330,0006003,1140,M,1,M1,Motorway,OnGround,TwoOrMoreLanes,Motorway,State,Hunter,Gosford,Calga,2250,Tirtl,false,1,1,9692408,4472191.5,-33.429348,151.22467,9,4,true,fb432bfc97bbde546623e45ad0e2340c,2018-06-12 02:48:41.978017+00
,6903,,,58185,95031,Hume Highway,Hume Highway,"Hume Highway, East of Tumbarumba Road",Hume Highway,East of Tumbarumba Road,Hume,Highway,Tumbarumba Road,2220,0000002,2055,M,31,M31,Primary Road,OnGround,TwoOrMoreLanes,Highway,State,South West,Wagga Wagga,Kyeamba,2650,Trafficorder Dual Tube Classifier,false,0,0,9357044,4257887.5,-35.432598,147.628342,9,5,true,dd6a157b8b10f9aae436918985a4a339,2018-06-12 02:48:41.978017+00
,6904,,,57587,91162,Bruxner Highway,Bruxner Highway,"Bruxner Highway, South of Bruxner Road",Bruxner Highway,South of Bruxner Road,Bruxner,Highway,Bruxner Road,2130,0000016,0390,B,60,B60,Primary Road,OnGround,TwoOrMoreLanes,Highway,State,Northern,Tenterfield,Tabulam,2469,Trafficorder Tube Axlepair Counter,false,0,1,9838423,4969234.5,-28.889633,152.511948,10,5,true,2cfa43d3050b2e45558d1240ea79ef91,2018-06-12 02:48:41.978017+00
,6905,,,58878,HHW006,Hume Highway,Hume Highway,"Hume Highway, West of Yass Valley Way","Hume.hume Highway, Nr Yass",West of Yass Valley Way,Hume,Highway,Yass Valley Way,490,0000002,1552,M,31,M31,Primary Road,OnGround,TwoOrMoreLanes,Highway,State,South West,Yass Valley,Manton,2582,Tirtl,false,1,1,9483555,4322406.5,-34.836449,149.007996,9,4,true,b4c6ea2476447c612643cb6847e68e54,2018-06-12 02:48:41.978017+00
,6906,,,57536,87002,Western Motorway,Western Motorway,"Western Motorway, South of Hatchinson Crescent",Western Motorway,South of Hatchinson Crescent,Western,Motorway,Hatchinson Crescent,140,0006004,1250,M,4,M4,Motorway,OnGround,TwoOrMoreLanes,Motorway,State,Sydney,Penrith,Jamisontown,2750,Trafficorder Tube Axlepair Counter,false,0,0,9639874,4435846.5,-33.775021,150.67334,10,5,true,22d3213ec6f161f90492fd219daf1620,2018-06-12 02:48:41.978017+00
,6907,,,55338,02151,Oxford Street,Oxford Street,"Oxford Street, West of Palmer Street",Oxford Street,West of Palmer Street,Oxford,Street,Palmer Street,40,0000172,0005,NULL,NULL,NULL,Arterial Road,OnGround,TwoOrMoreLanes,Street,State,Sydney,Sydney,Darlinghurst,2010,Trafficorder Tube Axlepair Counter,false,0,0,9689555,4422374.5,-33.879578,151.215622,10,5,true,b2e8ccbd370daf4d7e276fa935cd26be,2018-06-12 02:48:41.978017+00
,6908,,,58061,94052,Coolac Road,Coolac Road,"Coolac Road, West of Hume Highway",Coolac Road,West of Hume Highway,Coolac,Road,Hume Highway,1080,0000002,1745,NULL,NULL,NULL,Local Road,OnGround,TwoOrMoreLanes,Road,Local,South West,Gundagai,Coolac,2727,Trafficorder Tube Axlepair Counter,false,0,1,9406685,4315115.5,-34.912739,148.168076,9,5,true,7bceb2480442c0bebb2b3b977f819f2b,2018-06-12 02:48:41.978017+00
,6909,,,57713,92220,Newell Highway,Newell Highway,"Newell Highway, South of Tarlee Road",Newell Highway,South of Tarlee Road,Newell,Highway,Tarlee Road,960,0000017,3221,A,39,A39,Primary Road,OnGround,TwoOrMoreLanes,Highway,State,Western,Narrabri,Edgeroi,2390,Trafficorder Dual Tube Classifier,false,0,0,9570102,4842625,-30.125902,149.801788,1,5,true,3f26d3c707f167b44dc25821112b529e,2018-06-12 02:48:41.978017+00
,6910,,,55688,04663,Tweed Valley Way,Tweed Valley Way,"Tweed Valley Way, East of Leddays Creek Road",Tweed Valley Way,East of Leddays Creek Road,Tweed Valley,Way,Leddays Creek Road,80,0000679,3360,NULL,NULL,NULL,Arterial Road,OnGround,TwoOrMoreLanes,Way,Regional,Northern,Tweed,Stotts Creek,2487,Trafficorder Tube Axlepair Counter,false,0,1,9938969,5031735,-28.275921,153.499039,9,5,true,717fd3c243b779152abfea3583855224,2018-06-12 02:48:41.978017+00
,6911,,,57804,92727,Barwan Street,Barwan Street,"Barwan Street, North of Killarney Street",Barwan Street,North of Killarney Street,Barwan,Street,Killarney Street,80,0000017,3203,A,39,A39,Local Road,OnGround,TwoOrMoreLanes,Street,State,Western,Narrabri,Narrabri,2390,Trafficorder Tube Axlepair Counter,false,0,0,9567587,4821167,-30.319923,149.781632,9,5,true,2046b21741a46174e2553c7e7aed6992,2018-06-12 02:48:41.978017+00
,6912,,,57213,65011,Elizabeth Drive,Elizabeth Drive,"Elizabeth Drive, South of Cabramatta Road",Elizabeth Drive,South of Cabramatta Road,Elizabeth,Drive,Cabramatta Road,70,0000535,0150,NULL,NULL,NULL,Arterial Road,OnGround,TwoOrMoreLanes,Drive,State,Sydney,Fairfield,Bonnyrigg,2177,Trafficorder Tube Axlepair Counter,false,0,0,9659390,4421989,-33.893608,150.889648,9,5,true,ac4506a5b6628e8786474911cbee2afa,2018-06-12 02:48:41.978017+00
,6913,,,58092,94151,Monaro Street,Monaro Street,"Monaro Street, East of Collett Street",Bungendore Road,East of Collett Street,Monaro,Street,Collett Street,40,0000051,0335,B,52,B52,Arterial Road,OnBridge,TwoOrMoreLanes,Road,State,Southern,Queanbeyan,Queanbeyan East,2620,Trafficorder Tube Axlepair Counter,false,0,0,9503240,4264803.5,-35.352177,149.236771,10,5,true,43ac4930046eb0d442020e6fc7ad9378,2018-06-12 02:48:41.978017+00
,6914,,,56166,05856,Macquarie Road,Macquarie Road,"Macquarie Road, North of Hillsborough Road",Macquarie Road,North of Hillsborough Road,Macquarie,Road,Hillsborough Road,40,0000527,0220,B,89,B89,Arterial Road,OnGround,TwoOrMoreLanes,Road,State,Hunter,Lake Macquarie,Lakelands,2282,Trafficorder Tube Axlepair Counter,false,0,0,9734406,4521757,-32.966324,151.652496,1,5,true,ee3b2b6b8c05e6a1ec75ac5f5f60e576,2018-06-12 02:48:41.978017+00
,6915,,,57593,91190,New England Highway,New England Highway,"New England Highway, South of Bargens Road",New England Highway,South of Bargens Road,New England,Highway,Bargens Road,130,0000009,1410,A,15,A15,Primary Road,OnGround,TwoOrMoreLanes,Highway,State,Northern,Glen Innes Severn,Dundee,2370,Trafficorder Tube Axlepair Counter,false,0,1,9771835,4897363.5,-29.56608,151.865555,9,5,true,c5b1268377d06ceb25c5dcfec1db15e4,2018-06-12 02:48:41.978017+00
,6916,,,58553,97122,Sturt Highway,Sturt Highway,"Sturt Highway, East of Conargo Road",Sturt Highway,East of Conargo Road,Sturt,Highway,Conargo Road,900,0000014,0320,A,20,A20,Primary Road,OnGround,TwoOrMoreLanes,Highway,State,South West,Murrumbidgee,Carrathool,2711,Trafficorder Tube Axlepair Counter,false,0,0,9155845,4363877.5,-34.468513,145.429764,10,5,true,d01616e8a43c08d097b262d27a9cb741,2018-06-12 02:48:41.978017+00
,6917,,,56298,07354,Moss Vale Road,Moss Vale Road,"Moss Vale Road, North of Cambewarra Road",Cambewarra Road,North of Cambewarra Road,Moss Vale,Road,Cambewarra Road,110,0000261,0011,B,73,B73,Arterial Road,OnGround,TwoOrMoreLanes,Road,State,Southern,Shoalhaven,Bomaderry,2541,Trafficorder Tube Axlepair Counter,false,0,1,9628408,4317914,-34.841934,150.593338,10,5,true,e190d4d450559ac4ead50572ad52598a,2018-06-12 02:48:41.978017+00
,6918,,,58515,96556,Kamilaroi Highway,Kamilaroi Highway,"Kamilaroi Highway, South of Merrywinebone Road",Kamilaroi Highway,South of Merrywinebone Road,Kamilaroi,Highway,Merrywinebone Road,780,0000029,0500,NULL,NULL,NULL,Primary Road,OnGround,TwoOrMoreLanes,Highway,State,Western,Walgett,Burren Junction,2386,Trafficorder Dual Tube Classifier,false,0,1,9488930,4850187.5,-30.074413,148.958557,9,5,true,a7afa546cb2cb7f13ba0cdf549690133,2018-06-12 02:48:41.978017+00
,6919,,,57305,70067,Eastern Road,Eastern Road,"Eastern Road, East of Westlink M7","Eastern.eastern Rd, Rooty Hill",East of Westlink M7,Eastern,Road,Westlink M7,470,0007170,0005,NULL,NULL,NULL,Distributor Road,OnGround,TwoOrMoreLanes,Road,Regional,Sydney,Blacktown,Rooty Hill,2766,Trafficorder Loop Counter,false,1,0,9656950,4435604.5,-33.771648,150.857834,10,4,true,81301bba0e7cc4bf2d6e24fafa547597,2018-06-12 02:48:41.978017+00
,6920,,,55327,02056,Abercrombie Street,Abercrombie Street,"Abercrombie Street, North of Cleveland Street",Abercrombie Street,North of Cleveland Street,Abercrombie,Street,Cleveland Street,30,0000594,0010,NULL,NULL,NULL,Arterial Road,OnGround,TwoOrMoreLanes,Street,State,Sydney,Sydney,Chippendale,2008,Trafficorder Dual Tube Classifier,false,0,0,9687970,4421463.5,-33.888367,151.198883,1,5,true,60ecd8d6b06f2bc8b7997bbfb1efee9a,2018-06-12 02:48:41.978017+00
,6921,,,57140,55049,Pittwater Road,Pittwater Road,"Pittwater Road, North of Jenkins Street",Pittwater Road,North of Jenkins Street,Pittwater,Road,Jenkins Street,20,0000164,0570,A,8,A8,Arterial Road,OnGround,TwoOrMoreLanes,Road,State,Sydney,Warringah,Collaroy,2097,Tirtl,false,1,1,9698043,4438672.5,-33.729507,151.30011,9,5,true,a64317aa7bee12ab66f2cb36eb36abb1,2018-06-12 02:48:41.978017+00
,6922,,,58626,97459,Hardinge Street,Hardinge Street,"Hardinge Street, East of Ochtertyre Street",Hardinge Street,East of Ochtertyre Street,Hardinge,Street,Ochtertyre Street,60,0000021,0093,B,75,B75,Local Road,OnGround,TwoOrMoreLanes,Street,State,South West,Deniliquin,Deniliquin,2710,Trafficorder Tube Axlepair Counter,false,0,0,9114056,4244930,-35.534504,144.949234,9,5,true,ee0821b6edab36157e2ee34ec4dcc546,2018-06-12 02:48:41.978017+00
,6923,,,55565,04301,Lismore Road,Lismore Road,"Lismore Road, East of Robinson Street",Lismore - Bangalow Road,East of Robinson Street,Lismore,Road,Robinson Street,10,0000065,0102,B,62,B62,Arterial Road,OnGround,TwoOrMoreLanes,Road,State,Northern,Byron,Bangalow,2479,Trafficorder Tube Axlepair Counter,false,0,1,9938356,4985965.5,-28.687433,153.521851,10,5,true,2e6b78bef836ed419e0d9c412759555d,2018-06-12 02:48:41.978017+00
,6924,,,56371,07740,Princes Motorway,Princes Motorway,"Princes Motorway, West of Cawleys Road",Princes Motorway,West of Cawleys Road,Princes,Motorway,Cawleys Road,220,0006006,1000,M,1,M1,Motorway,OnGround,TwoOrMoreLanes,Motorway,State,Southern,Wollongong,Helensburgh,2508,Trafficorder Loop Counter,false,1,0,9666706,4391991,-34.161606,150.981125,9,4,true,1f5f3932897bbfd2940633c6fb806dae,2018-06-12 02:48:41.978017+00
